,tweet_id,text,link,created_at,timestamp_ms,user_id,user_name,user_screen_name,user_location,geo,coordinates,place_full_name,place_country,retweeted_status_id,in_reply_to_status_id,sarcasm_value,processed_tweets,polarity_scores,compounded,neutral,positive,negative,candidate
0,1.31708e+18,"RT @Hoosiers1986: If Hunter Biden was a Trump, every news story would be these damn e-mails! This is Bullshit! 

Agree?!?!",https://twitter.com/HealingSelf2/status/1317079898838626305,16/10/2020 12:28,1602850000000.0,1.19384e+18,Healing Self✨🌟🌟🌟✨,HealingSelf2,,,,,,1.3169e+18,,-61,RT If Hunter Biden Trump every news story would damn emails This Bullshit Agree,"{'neg': 0.325, 'neu': 0.55, 'pos': 0.125, 'compound': -0.6124}",-0.6124,0.55,0.125,0.325,Trump
7,1.31708e+18,RT @ChuckCallesto: BREAKING REPORT: Feds investigating if alleged Hunter Biden emails CONNECTED TO FOREIGN INTELLIGENCE operation...,https://twitter.com/Chiphead_Nate/status/1317079900185088000,16/10/2020 12:28,1602850000000.0,9.71754e+17,Nathan Howard,Chiphead_Nate,,,,,,1.31695e+18,,-1,RT BREAKING REPORT Feds investigating alleged Hunter Biden emails CONNECTED TO FOREIGN INTELLIGENCE operation,"{'neg': 0.0, 'neu': 0.772, 'pos': 0.228, 'compound': 0.5904}",0.5904,0.772,0.228,0.0,Trump
8,1.31708e+18,RT @AKA_RealDirty: President Trump was on top of his game debating this insufferable Twatt @SavannahGuthrie. https://t.co/ll7nynBVjF,https://twitter.com/stahawg/status/1317079900176764929,16/10/2020 12:28,1602850000000.0,75855716.0,Stan Staton,stahawg,"Arkansas, USA",,,,,1.31708e+18,,-11,RT President Trump top game debating insufferable Twatt httpstcoll7nynB VjF,"{'neg': 0.0, 'neu': 0.833, 'pos': 0.167, 'compound': 0.2023}",0.2023,0.833,0.167,0.0,Trump
10,1.31708e+18,RT @williamlegate: Trump's last 3 campaign managers have all been arrested.,https://twitter.com/IWLarmtUnited/status/1317079900243828736,16/10/2020 12:28,1602850000000.0,8.28606e+17,IWLarchmontUnited1,IWLarmtUnited,"Larchmont, NY",,,,,1.31692e+18,,-16,RT Trumps last 3 campaign managers arrested,"{'neg': 0.383, 'neu': 0.617, 'pos': 0.0, 'compound': -0.4767}",-0.4767,0.617,0.0,0.383,Trump
15,1.31708e+18,"Molly has decided her weekend project is to make yard signs that say ""Trump is Prince John"" and I'm okay with this. https://t.co/6Op6TZn6kb",https://twitter.com/emilyrmurtagh/status/1317079902705930242,16/10/2020 12:28,1602850000000.0,19620857.0,Emily Russo Murtagh,emilyrmurtagh,"Portland, ME",,,,,,,76,Molly decided weekend project make yard signs say Trump Prince John Im okay httpstco6 Op6T Zn6kb,"{'neg': 0.0, 'neu': 0.888, 'pos': 0.112, 'compound': 0.2263}",0.2263,0.888,0.112,0.0,Trump
17,1.31708e+18,RT @TheEpicDept: President Trump's latest retweeted buddy https://t.co/rXj0uMrQte,https://twitter.com/euancx/status/1317079903590862850,16/10/2020 12:28,1602850000000.0,19588465.0,Euan CX,euancx,Glasgow,,,,,1.31693e+18,,-21,RT President Trumps latest retweeted buddy httpstcor Xj0u Mr Qte,"{'neg': 0.0, 'neu': 1.0, 'pos': 0.0, 'compound': 0.0}",0.0,1.0,0.0,0.0,Trump
19,1.31708e+18,"RT @Hoosiers1986: If Hunter Biden was a Trump, every news story would be these damn e-mails! This is Bullshit! 

Agree?!?!",https://twitter.com/perryhallpaul/status/1317079903557292032,16/10/2020 12:28,1602850000000.0,8.13788e+17,perryhall paul,perryhallpaul,"Perry Hall, MD",,,,,1.3169e+18,,-61,RT If Hunter Biden Trump every news story would damn emails This Bullshit Agree,"{'neg': 0.325, 'neu': 0.55, 'pos': 0.125, 'compound': -0.6124}",-0.6124,0.55,0.125,0.325,Trump
20,1.31708e+18,Leading Scientists Urge Voters to Dump Trump https://t.co/dm34u2kJlx,https://twitter.com/JoePDR/status/1317079903905452039,16/10/2020 12:28,1602850000000.0,7.50436e+17,Joe,JoePDR,"Playa Del Rey, CA",,,,,,,-1,Leading Scientists Urge Voters Dump Trump httpstcodm34u2k Jlx,"{'neg': 0.271, 'neu': 0.729, 'pos': 0.0, 'compound': -0.3818}",-0.3818,0.729,0.0,0.271,Trump
22,1.31708e+18,RT @Usatorz1: Rt If you agree OANN should have done the town hall with President Trump.,https://twitter.com/AnnTheo5/status/1317079907197997057,16/10/2020 12:28,1602850000000.0,1.05115e+18,TelltheTruth,AnnTheo5,,,,,,1.31704e+18,,-57,RT Rt If agree OANN done town hall President Trump,"{'neg': 0.0, 'neu': 0.783, 'pos': 0.217, 'compound': 0.3612}",0.3612,0.783,0.217,0.0,Trump
33,1.31708e+18,"@JoyceWhiteVance There are none, trump knows or cares very little of truth.",https://twitter.com/230emain/status/1317079907634171904,16/10/2020 12:28,1602850000000.0,4534950261.0,James,230emain,"New York, USA",,,,,,1.31707e+18,-52,There none trump knows cares little truth,"{'neg': 0.261, 'neu': 0.527, 'pos': 0.212, 'compound': -0.1212}",-0.1212,0.527,0.212,0.261,Trump
35,1.31708e+18,"RT @GOPChairwoman: Daily Wire: Savannah Guthrie Blasted For Hostile Behavior Toward Trump During Town Hall

https://t.co/KXS72cUkOi",https://twitter.com/wwindteacher/status/1317079907772567552,16/10/2020 12:28,1602850000000.0,8.14816e+17,"Harold Joe New, III",wwindteacher,"El Paso, TX",,,,,1.31692e+18,,-25,RT Daily Wire Savannah Guthrie Blasted For Hostile Behavior Toward Trump During Town HallhttpstcoKXS72c Uk Oi,"{'neg': 0.148, 'neu': 0.852, 'pos': 0.0, 'compound': -0.3818}",-0.3818,0.852,0.0,0.148,Trump
36,1.31708e+18,RT @DFBHarvard: RETWEET If you believe Savannah Guthrie tried a hatchet job on President Trump last night! https://t.co/PqfZr0w5BM,https://twitter.com/BarryHart7/status/1317079907760021504,16/10/2020 12:28,1602850000000.0,860110616.0,Barry Hart,BarryHart7,Clearwater,,,,,1.31707e+18,,-5,RT RETWEET If believe Savannah Guthrie tried hatchet job President Trump last night httpstco Pqf Zr0w5BM,"{'neg': 0.0, 'neu': 1.0, 'pos': 0.0, 'compound': 0.0}",0.0,1.0,0.0,0.0,Trump
40,1.31708e+18,@EnglishFars how  long #Trump will call @iaeaorg as trash?,https://twitter.com/HoermanTomas/status/1317079908280160266,16/10/2020 12:28,1602850000000.0,1.2152e+18,Tomas Hoerman,HoermanTomas,,,,,,,1.31708e+18,-10,long Trump call trash,"{'neg': 0.0, 'neu': 1.0, 'pos': 0.0, 'compound': 0.0}",0.0,1.0,0.0,0.0,Trump
41,1.31708e+18,RT @UrbanAchievr: Crazy Uncle Trump thinks the Babylon Bee is real https://t.co/YBwLQDz18k,https://twitter.com/JulieBa73315767/status/1317079911333613569,16/10/2020 12:28,1602850000000.0,1.3111e+18,Julie Bartlett,JulieBa73315767,,,,,,1.31705e+18,,-15,RT Crazy Uncle Trump thinks Babylon Bee real httpstcoY BwLQ Dz18k,"{'neg': 0.194, 'neu': 0.806, 'pos': 0.0, 'compound': -0.34}",-0.34,0.806,0.0,0.194,Trump
43,1.31708e+18,@ProjectLincoln Guys have daughters. Trump and Pence don't realize that.,https://twitter.com/RobertPDean1/status/1317079911622877184,16/10/2020 12:28,1602850000000.0,1.08752e+18,Robert P. Dean,RobertPDean1,"Denver, CO",,,,,,1.31707e+18,-23,Guys daughters Trump Pence dont realize,"{'neg': 0.0, 'neu': 1.0, 'pos': 0.0, 'compound': 0.0}",0.0,1.0,0.0,0.0,Trump
44,1.31708e+18,@kylegriffin1 Laughing at ALL the California MAGA people for supporting Trump.,https://twitter.com/iseeidiotstoday/status/1317079911740272641,16/10/2020 12:28,1602850000000.0,9.58119e+17,Al,iseeidiotstoday,"Orange County , CA",,,,,,1.31707e+18,14,Laughing ALL California MAGA people supporting Trump,"{'neg': 0.0, 'neu': 0.45, 'pos': 0.55, 'compound': 0.7269}",0.7269,0.45,0.55,0.0,Trump
46,1.31708e+18,RT @ACTBrigitte: RT if you joined Twitter BECAUSE of President Donald Trump.,https://twitter.com/SaveThePlanet04/status/1317079911870455809,16/10/2020 12:28,1602850000000.0,4454973808.0,CWP,SaveThePlanet04,,,,,,1.31671e+18,,-28,RT RT joined Twitter BECAUSE President Donald Trump,"{'neg': 0.0, 'neu': 1.0, 'pos': 0.0, 'compound': 0.0}",0.0,1.0,0.0,0.0,Trump
50,1.31708e+18,"RT @tomorrawdotcom: Trump slams Facebook, Twitter for taking down Biden story in NY Post",https://twitter.com/cat25RIII2/status/1317079912398917632,16/10/2020 12:28,1602850000000.0,7.67375e+17,@cat25RIII,cat25RIII2,"Texas, USA",,,,,1.31668e+18,,-41,RT Trump slams Facebook Twitter taking Biden story NY Post,"{'neg': 0.0, 'neu': 1.0, 'pos': 0.0, 'compound': 0.0}",0.0,1.0,0.0,0.0,Trump
51,1.31708e+18,RT @UrbanAchievr: Crazy Uncle Trump thinks the Babylon Bee is real https://t.co/YBwLQDz18k,https://twitter.com/MazzolaFrank/status/1317079912566673408,16/10/2020 12:28,1602850000000.0,519788153.0,864511320,MazzolaFrank,,,,,,1.31705e+18,,-15,RT Crazy Uncle Trump thinks Babylon Bee real httpstcoY BwLQ Dz18k,"{'neg': 0.194, 'neu': 0.806, 'pos': 0.0, 'compound': -0.34}",-0.34,0.806,0.0,0.194,Trump
55,1.31708e+18,RT @JJohnsonLaw: So Trump could only do one hour and Joe is doing 90 minutes?,https://twitter.com/deepen915/status/1317079915452313602,16/10/2020 12:28,1602850000000.0,16207883.0,Deepen Gandhi 🇺🇸 🌊 🖤 ✊🏾,deepen915,NJ,,,,,1.31691e+18,,-48,RT So Trump could one hour Joe 90 minutes,"{'neg': 0.0, 'neu': 1.0, 'pos': 0.0, 'compound': 0.0}",0.0,1.0,0.0,0.0,Trump
56,1.31708e+18,RT @hodgetwins: This tweet goes out to the woman nodding for Trump. Retweet this so she sees it. She deserves a medal.,https://twitter.com/Lindampi619/status/1317079915456569346,16/10/2020 12:28,1602850000000.0,3440435112.0,Linda Ike,Lindampi619,,,,,,1.3169e+18,,-34,RT This tweet goes woman nodding Trump Retweet sees She deserves medal,"{'neg': 0.0, 'neu': 0.78, 'pos': 0.22, 'compound': 0.4767}",0.4767,0.78,0.22,0.0,Trump
57,1.31708e+18,vote for PRESIDENT TRUMP if you love AMERICA.,https://twitter.com/tonabonneville/status/1317079915456581633,16/10/2020 12:28,1602850000000.0,1423493726.0,tona rigsby,tonabonneville,shawneetown il,,,,,,,-45,vote PRESIDENT TRUMP love AMERICA,"{'neg': 0.0, 'neu': 0.488, 'pos': 0.512, 'compound': 0.6369}",0.6369,0.488,0.512,0.0,Trump
60,1.31708e+18,"@realDonaldTrump Its all fake, the are fske news generator.
see all these people 
https://t.co/b8g9uKNfMI",https://twitter.com/LavieGuied/status/1317079915510988801,16/10/2020 12:28,1602850000000.0,1.01623e+18,lavieguide,LavieGuied,,,,,,,1.31708e+18,36,Its fake fske news generatorsee people httpstcob8g9uK NfMI,"{'neg': 0.307, 'neu': 0.693, 'pos': 0.0, 'compound': -0.4767}",-0.4767,0.693,0.0,0.307,Trump
64,1.31708e+18,RT @MaryLTrump: Actually . . .,https://twitter.com/UlinChris/status/1317079915792158720,16/10/2020 12:28,1602850000000.0,2572919094.0,Chris Ulin,UlinChris,TEXAS,,,,,1.3169e+18,,-54,RT Actually,"{'neg': 0.0, 'neu': 1.0, 'pos': 0.0, 'compound': 0.0}",0.0,1.0,0.0,0.0,Trump
65,1.31708e+18,RT @anthonyvclark20: I wish we hated the system that led to Trump as much as we hate Trump......,https://twitter.com/mollz624/status/1317079915913711618,16/10/2020 12:28,1602850000000.0,544650785.0,Molly,mollz624,,,,,,1.31679e+18,,-69,RT I wish hated system led Trump much hate Trump,"{'neg': 0.476, 'neu': 0.361, 'pos': 0.163, 'compound': -0.7351}",-0.7351,0.361,0.163,0.476,Trump
67,1.31708e+18,RT @sarahcpr: Wow how much can I get paid to sit behind Trump and nod at everything he says,https://twitter.com/KarandeepDizzle/status/1317079915867430912,16/10/2020 12:28,1602850000000.0,140226450.0,Karan Sandhu,KarandeepDizzle,"Seattle, WA",,,,,1.3169e+18,,-29,RT Wow much I get paid sit behind Trump nod everything says,"{'neg': 0.0, 'neu': 0.725, 'pos': 0.275, 'compound': 0.5859}",0.5859,0.725,0.275,0.0,Trump
69,1.31708e+18,"RT @GOPChairwoman: Daily Wire: Savannah Guthrie Blasted For Hostile Behavior Toward Trump During Town Hall

https://t.co/KXS72cUkOi",https://twitter.com/X17group/status/1317079916010180615,16/10/2020 12:28,1602850000000.0,1.27598e+18,X17,X17group,,,,,,1.31692e+18,,-25,RT Daily Wire Savannah Guthrie Blasted For Hostile Behavior Toward Trump During Town HallhttpstcoKXS72c Uk Oi,"{'neg': 0.148, 'neu': 0.852, 'pos': 0.0, 'compound': -0.3818}",-0.3818,0.852,0.0,0.148,Trump
70,1.31708e+18,"RT @DavidJollyFL: Nothing Sasse said should turn the focus to Trump, it should turn the focus squarely on Sasse, for a long while.",https://twitter.com/KsKM3/status/1317079916169539586,16/10/2020 12:28,1602850000000.0,23110912.0,Remove Trump 202-224-3121☎️,KsKM3,Boston,,,,,1.31707e+18,,-79,RT Nothing Sasse said turn focus Trump turn focus squarely Sasse long,"{'neg': 0.0, 'neu': 1.0, 'pos': 0.0, 'compound': 0.0}",0.0,1.0,0.0,0.0,Trump
71,1.31708e+18,@aginnt @JoeBiden @realDonaldTrump Because trump is a walking biohazard,https://twitter.com/thortallmon/status/1317079916182196230,16/10/2020 12:28,1602850000000.0,8.31885e+17,Շђ๏г Շคɭɭ๓๏ภ #icantbreathe #blm,thortallmon,"Overland Park, KS",,,,,,1.31695e+18,-39,Because trump walking biohazard,"{'neg': 0.0, 'neu': 1.0, 'pos': 0.0, 'compound': 0.0}",0.0,1.0,0.0,0.0,Trump
72,1.31708e+18,RT @TheBabylonBee: President Trump Declares The Babylon Bee His Most-Trusted News Source https://t.co/oObdxaH3w6,https://twitter.com/GoetzEvenBetter/status/1317079916215717888,16/10/2020 12:28,1602850000000.0,331720602.0,Andrew Goetz,GoetzEvenBetter,,,,,,1.31707e+18,,-6,RT President Trump Declares The Babylon Bee His Most Trusted News Source httpstcoo ObdxaH3w6,"{'neg': 0.0, 'neu': 0.793, 'pos': 0.207, 'compound': 0.5256}",0.5256,0.793,0.207,0.0,Trump
75,1.31708e+18,RT @JFNYC1: Biden is trying to take the seat from Trump  https://t.co/SHtLdq2CL2,https://twitter.com/JoelGuidry3/status/1317079916224053248,16/10/2020 12:28,1602850000000.0,8.01424e+17,Cajun Dad,JoelGuidry3,"Louisiana, USA",,,,,1.31707e+18,,-39,RT Biden trying take seat Trump httpstcoS Ht Ldq2CL2,"{'neg': 0.0, 'neu': 1.0, 'pos': 0.0, 'compound': 0.0}",0.0,1.0,0.0,0.0,Trump
76,1.31708e+18,RT @mccaffreyr3: This ad states the only argument needed to eject Trump from office. Vote for DECENCY.,https://twitter.com/KsnurseVictoria/status/1317079916517740544,16/10/2020 12:28,1602850000000.0,2750790104.0,Victoria,KsnurseVictoria,,,,,,1.31682e+18,,-29,RT This ad states argument needed eject Trump office Vote DECENCY,"{'neg': 0.2, 'neu': 0.8, 'pos': 0.0, 'compound': -0.3612}",-0.3612,0.8,0.0,0.2,Trump
77,1.31708e+18,RT @realDonaldTrump: Biden lied Pennsylvania!,https://twitter.com/NewHeavenZone21/status/1317079919671889923,16/10/2020 12:28,1602850000000.0,1.25365e+18,IPOB New Heaven Zone 2 Aba,NewHeavenZone21,,,,,,1.31706e+18,,-49,RT Biden lied Pennsylvania,"{'neg': 0.464, 'neu': 0.536, 'pos': 0.0, 'compound': -0.3818}",-0.3818,0.536,0.0,0.464,Trump
78,1.31708e+18,RT @UrbanAchievr: Crazy Uncle Trump thinks the Babylon Bee is real https://t.co/YBwLQDz18k,https://twitter.com/caresaboutxmas/status/1317079919852244992,16/10/2020 12:28,1602850000000.0,1.31166e+18,Gives a Fuck about Christmas,caresaboutxmas,,,,,,1.31705e+18,,-15,RT Crazy Uncle Trump thinks Babylon Bee real httpstcoY BwLQ Dz18k,"{'neg': 0.194, 'neu': 0.806, 'pos': 0.0, 'compound': -0.34}",-0.34,0.806,0.0,0.194,Trump
79,1.31708e+18,Savannah Gutherie showed America why they must vote TRUMP. SHE WAS CRAZY &amp; Manic,https://twitter.com/DeniseCiccotto/status/1317079920225509378,16/10/2020 12:28,1602850000000.0,387345205.0,Honey Dew,DeniseCiccotto,United States,,,"Viera West, FL",United States,,,-47,Savannah Gutherie showed America must vote TRUMP SHE WAS CRAZY amp Manic,"{'neg': 0.222, 'neu': 0.778, 'pos': 0.0, 'compound': -0.4824}",-0.4824,0.778,0.0,0.222,Trump
80,1.31708e+18,@realDonaldTrump @GStephanopoulos Traitor of USA is Trump,https://twitter.com/SandraC15345423/status/1317079920141545473,16/10/2020 12:28,1602850000000.0,1.16849e+18,Sandra Cornelius,SandraC15345423,,,,,,,1.31705e+18,-42,Traitor USA Trump,"{'neg': 0.0, 'neu': 1.0, 'pos': 0.0, 'compound': 0.0}",0.0,1.0,0.0,0.0,Trump
84,1.31708e+18,"RT @LetItRain233: If qanon is against pedophiles, why did Savannah Guthrie want President Trump to denounce them? Is she for pedophiles?",https://twitter.com/144000bound/status/1317079920137351170,16/10/2020 12:28,1602850000000.0,248944940.0,Allen May ⭐️⭐️⭐️🇺🇸🇮🇱,144000bound,,,,,,1.31694e+18,,-37,RT If qanon pedophiles Savannah Guthrie want President Trump denounce Is pedophiles,"{'neg': 0.175, 'neu': 0.73, 'pos': 0.095, 'compound': -0.2732}",-0.2732,0.73,0.095,0.175,Trump
85,1.31708e+18,"RT @realDonaldTrump: Thank you LIBERTARIANS. We are getting it all done, and FAST! VOTE TRUMP!!! https://t.co/ai2vTb1V3G",https://twitter.com/GlenWildfang/status/1317079920082903043,16/10/2020 12:28,1602850000000.0,1.25727e+18,God IS who he says He IS,GlenWildfang,,,,,,1.31706e+18,,2,RT Thank LIBERTARIANS We getting done FAST VOTE TRUMP httpstcoai2v Tb1V3G,"{'neg': 0.0, 'neu': 0.675, 'pos': 0.325, 'compound': 0.516}",0.516,0.675,0.325,0.0,Trump
86,1.31708e+18,"RT @Dknight10k: Alright. Here we go. As promised, I will live tweet this Trump town hall, aka commit emotional suicide.

Thread.",https://twitter.com/homemaidmama11/status/1317079920129048582,16/10/2020 12:28,1602850000000.0,7.308e+17,🌞🌊RiseUpNow🌊🌞,homemaidmama11,Maine USA,,,,,1.31689e+18,,-79,RT Alright Here go As promised I live tweet Trump town hall aka commit emotional suicide Thread,"{'neg': 0.189, 'neu': 0.462, 'pos': 0.349, 'compound': 0.2023}",0.2023,0.462,0.349,0.189,Trump
87,1.31708e+18,"RT @CraigSh8: @realDonaldTrump VOTE SMART- VOTE TRUMP!!
#MAGA https://t.co/rRzajXZ8fu",https://twitter.com/Saieh001/status/1317079920435253250,16/10/2020 12:28,1602850000000.0,141041525.0,Luis  A Saieh,Saieh001,,,,,,1.31706e+18,,23,RT VOTE SMART VOTE TRUMPMAGA httpstcor RzajXZ8fu,"{'neg': 0.0, 'neu': 0.636, 'pos': 0.364, 'compound': 0.5319}",0.5319,0.636,0.364,0.0,Trump
89,1.31708e+18,RT @ReneeAlida: Waiting for Trump's re-tweet from the Onion.,https://twitter.com/hawkaye19/status/1317079920418357248,16/10/2020 12:28,1602850000000.0,314109491.0,Bruce T G Holt. 🇨🇦. ⚓ 🏴󠁧󠁢󠁷󠁬󠁳󠁿,hawkaye19,"Ottawa, Canada",,,,,1.31707e+18,,-22,RT Waiting Trumps retweet Onion,"{'neg': 0.0, 'neu': 1.0, 'pos': 0.0, 'compound': 0.0}",0.0,1.0,0.0,0.0,Trump
92,1.31708e+18,RT @AKA_RealDirty: President Trump was on top of his game debating this insufferable Twatt @SavannahGuthrie. https://t.co/ll7nynBVjF,https://twitter.com/Tucker_1948/status/1317079920481169409,16/10/2020 12:28,1602850000000.0,345674758.0,Hiroshiニートお爺ちゃん🎸No Mask World,Tucker_1948,大阪市　🇯🇵,,,,,1.31708e+18,,-11,RT President Trump top game debating insufferable Twatt httpstcoll7nynB VjF,"{'neg': 0.0, 'neu': 0.833, 'pos': 0.167, 'compound': 0.2023}",0.2023,0.833,0.167,0.0,Trump
93,1.31708e+18,"RT @funder: Network YouTube views as of 9pm

Biden: 507,445 ABC
Trump: 153,660 NBC",https://twitter.com/egonz2112/status/1317079920720416773,16/10/2020 12:28,1602850000000.0,8.88204e+17,"Ed Gonzalez #BoycottNRA #Basta, #resist 🍸⚣🌈",egonz2112,NY,,,,,1.31708e+18,,-28,RT Network You Tube views 9pm Biden 507445 ABC Trump 153660 NBC,"{'neg': 0.0, 'neu': 1.0, 'pos': 0.0, 'compound': 0.0}",0.0,1.0,0.0,0.0,Trump
94,1.31708e+18,RT @ACTBrigitte: Retweet if President Trump won that debate.,https://twitter.com/blueyerosa/status/1317079920892411905,16/10/2020 12:28,1602850000000.0,7.25138e+17,Rosa Sharon,blueyerosa,,,,,,1.31691e+18,,-15,RT Retweet President Trump debate,"{'neg': 0.0, 'neu': 1.0, 'pos': 0.0, 'compound': 0.0}",0.0,1.0,0.0,0.0,Trump
95,1.31708e+18,"RT @tonyschwartz: Ben Sasse excoriates Trump in a private call, doesn't have the courage to do so publicly. Craven cowardice.",https://twitter.com/viejatwit/status/1317079920921743361,16/10/2020 12:28,1602850000000.0,32890891.0,viejatwit,viejatwit,,,,,,1.31688e+18,,-36,RT Ben Sasse excoriates Trump private call doesnt courage publicly Craven cowardice,"{'neg': 0.193, 'neu': 0.807, 'pos': 0.0, 'compound': -0.3875}",-0.3875,0.807,0.0,0.193,Trump
96,1.31708e+18,RT @KathyNiece: Trump is pitiful. #MorningJoe https://t.co/R25Ycb9fiX,https://twitter.com/carmenBwifemom/status/1317079920800137216,16/10/2020 12:28,1602850000000.0,7.63206e+17,Kamala The Last Airbender Harris,carmenBwifemom,,,,,,1.31634e+18,,26,RT Trump pitiful Morning Joe httpstcoR25 Ycb9fiX,"{'neg': 0.348, 'neu': 0.652, 'pos': 0.0, 'compound': -0.4939}",-0.4939,0.652,0.0,0.348,Trump
101,1.31708e+18,RT @joncoopertweets: Moderator Savannah Guthrie hailed for keeping Trump in check at NBC town hall  https://t.co/P7jwP9mOyc,https://twitter.com/lbnect66odat/status/1317079924264607744,16/10/2020 12:28,1602850000000.0,1.21209e+18,LBNECT66odat,lbnect66odat,,,,,,1.31707e+18,,-14,RT Moderator Savannah Guthrie hailed keeping Trump check NBC town hall httpstcoP7jwP9m Oyc,"{'neg': 0.0, 'neu': 0.863, 'pos': 0.137, 'compound': 0.2263}",0.2263,0.863,0.137,0.0,Trump
102,1.31708e+18,"@Chef_Plus_More Yet Trump can post whatever he wants, including baselessly accusing previous presidents of murder.",https://twitter.com/johnnyapples906/status/1317079924436471808,16/10/2020 12:28,1602850000000.0,1.04115e+18,Bryan Koppana,johnnyapples906,"Michigan, USA",,,,,,1.31705e+18,2,Yet Trump post whatever wants including baselessly accusing previous presidents murder,"{'neg': 0.416, 'neu': 0.584, 'pos': 0.0, 'compound': -0.7506}",-0.7506,0.584,0.0,0.416,Trump
105,1.31708e+18,"RT @mhmck: What Trump has never said to Putin and never will:

""Get out of Ukraine.""

""Stop interfering in U.S. elections""",https://twitter.com/SolidarityRnwd/status/1317079924721831945,16/10/2020 12:28,1602850000000.0,2539747665.0,Solidarity Renewed ❤️✊✌️🇬🇧🇪🇺🇵🇱🇺🇦🤍❤️🤍,SolidarityRnwd,"Nottingham, England",,,,,1.31693e+18,,51,RT What Trump never said Putin never Get Ukraine Stop interfering US elections,"{'neg': 0.0, 'neu': 0.864, 'pos': 0.136, 'compound': 0.2235}",0.2235,0.864,0.136,0.0,Trump
107,1.31708e+18,RT @TX_WalkerRanger: Can we all be friends with the woman sitting behind Trump nodding?,https://twitter.com/CottonAn0n/status/1317079925044744195,16/10/2020 12:28,1602850000000.0,1.05554e+18,Cotton_An0n,CottonAn0n,"Lubbock, TX",,,,,1.31691e+18,,-39,RT Can friends woman sitting behind Trump nodding,"{'neg': 0.0, 'neu': 0.693, 'pos': 0.307, 'compound': 0.4767}",0.4767,0.693,0.307,0.0,Trump
108,1.31708e+18,"'He Knows': Trump Fixated On 'Likely' Loss To Biden, Per Trump Insider |... https://t.co/XXjwaSWrXA via @YouTube",https://twitter.com/KopaJude/status/1317079924998627336,16/10/2020 12:28,1602850000000.0,1472502049.0,Jude Kopa,KopaJude,,,,,,,,22,He Knows Trump Fixated On Likely Loss To Biden Per Trump Insider httpstcoX XjwaS WrXA via,"{'neg': 0.133, 'neu': 0.867, 'pos': 0.0, 'compound': -0.3182}",-0.3182,0.867,0.0,0.133,Trump
109,1.31708e+18,RT @UROCKlive1: What if putting our elected representatives up for sale to the highest bidder is not the best idea?,https://twitter.com/lbloveslife25/status/1317079925128630274,16/10/2020 12:28,1602850000000.0,22674353.0,lisaloveslife ✡🕉☯🆘️,lbloveslife25,"Long Island, NY",,,,,1.31702e+18,,-17,RT What putting elected representatives sale highest bidder best idea,"{'neg': 0.0, 'neu': 0.682, 'pos': 0.318, 'compound': 0.6369}",0.6369,0.682,0.318,0.0,Trump
112,1.31708e+18,"RT @RealAPolitics: PENNSYLVANIA PROJECTED VOTE TOTALS:
Donald Trump - 3,379,000
Joe Biden - 2,975,000",https://twitter.com/westodd_gigem/status/1317079928211427328,16/10/2020 12:28,1602850000000.0,3013874402.0,Wesley Todd,westodd_gigem,,,,,,1.31679e+18,,-34,RT PENNSYLVANIA PROJECTED VOTE TOTALS Donald Trump 3379000 Joe Biden 2975000,"{'neg': 0.0, 'neu': 1.0, 'pos': 0.0, 'compound': 0.0}",0.0,1.0,0.0,0.0,Trump
113,1.31708e+18,"RT @DavidJollyFL: Nothing Sasse said should turn the focus to Trump, it should turn the focus squarely on Sasse, for a long while.",https://twitter.com/avl1899/status/1317079928249069570,16/10/2020 12:28,1602850000000.0,7.7728e+17,トンボ,avl1899,,,,,,1.31707e+18,,-79,RT Nothing Sasse said turn focus Trump turn focus squarely Sasse long,"{'neg': 0.0, 'neu': 1.0, 'pos': 0.0, 'compound': 0.0}",0.0,1.0,0.0,0.0,Trump
114,1.31708e+18,RT @FuctupMike: Am I nuts or was Trump impeached for some shit Joe Biden did?,https://twitter.com/FuR_GusGus/status/1317079928307961856,16/10/2020 12:28,1602850000000.0,1.27344e+18,FurGus,FuR_GusGus,Earth,,,,,1.31696e+18,,-86,RT Am I nuts Trump impeached shit Joe Biden,"{'neg': 0.496, 'neu': 0.504, 'pos': 0.0, 'compound': -0.7096}",-0.7096,0.504,0.0,0.496,Trump
115,1.31708e+18,RT @williamlegate: Trump's last 3 campaign managers have all been arrested.,https://twitter.com/blubike321/status/1317079928383352833,16/10/2020 12:28,1602850000000.0,1.09005e+18,Blubike321,blubike321,"Florida, USA",,,,,1.31692e+18,,-16,RT Trumps last 3 campaign managers arrested,"{'neg': 0.383, 'neu': 0.617, 'pos': 0.0, 'compound': -0.4767}",-0.4767,0.617,0.0,0.383,Trump
116,1.31708e+18,@EricTrump No questions for trump about #EricTrumpsUkraineScandal total inside job on nbc,https://twitter.com/SK8Wireless/status/1317079928429490176,16/10/2020 12:28,1602850000000.0,131551901.0,SK8 Wireless,SK8Wireless,"Ottawa, Canada",,,,,,1.31707e+18,-6,No questions trump Eric Trumps Ukraine Scandal total inside job nbc,"{'neg': 0.362, 'neu': 0.638, 'pos': 0.0, 'compound': -0.6249}",-0.6249,0.638,0.0,0.362,Trump
117,1.31708e+18,RT @realDonaldTrump: Biden lied Pennsylvania!,https://twitter.com/Wheels_Ozzy/status/1317079928505094144,16/10/2020 12:28,1602850000000.0,761695832.0,Wheels ♿,Wheels_Ozzy,"Huntington, IN",,,,,1.31706e+18,,-49,RT Biden lied Pennsylvania,"{'neg': 0.464, 'neu': 0.536, 'pos': 0.0, 'compound': -0.3818}",-0.3818,0.536,0.0,0.464,Trump
127,1.31708e+18,RT @gtconway3d: It's amazing how much contempt @realDonaldTrump's own aides have for him.,https://twitter.com/RobDraper15/status/1317079929398374412,16/10/2020 12:28,1602850000000.0,1.27707e+18,chubby maestro,RobDraper15,,,,,,1.31694e+18,,-33,RT Its amazing much contempt aides,"{'neg': 0.328, 'neu': 0.345, 'pos': 0.328, 'compound': 0.0}",0.0,0.345,0.328,0.328,Trump
129,1.31708e+18,@RichardGrenell Someone in trump admin complaining about insufficient transparency. Another parody from The Onion???,https://twitter.com/jr_magpie/status/1317079929696231425,16/10/2020 12:28,1602850000000.0,1.07804e+18,JR Magpie,jr_magpie,"Ohio, USA",,,,,,1.31698e+18,-37,Someone trump admin complaining insufficient transparency Another parody The Onion,"{'neg': 0.167, 'neu': 0.833, 'pos': 0.0, 'compound': -0.2023}",-0.2023,0.833,0.0,0.167,Trump
