,tweet_id,text,link,created_at,timestamp_ms,user_id,user_name,user_screen_name,user_location,geo,coordinates,place_full_name,place_country,retweeted_status_id,in_reply_to_status_id,sarcasm_value,processed_tweets,polarity_scores,compounded,neutral,positive,negative,candidate
1003,1.31708e+18,RT @realTuckFrumper: Fox News Founder Rupert Murdoch Says Biden Will Beat Trump in a Landslide on Election Day https://t.co/mEQLWJV3Yx,https://twitter.com/Joe_Glidden/status/1317080163738218496,16/10/2020 12:29,1602850000000.0,8.30883e+17,Department of Redundancy Department 🌊,Joe_Glidden,United States,,,,,1.31696e+18,,-24,RT Fox News Founder Rupert Murdoch Says Biden Will Beat Trump Landslide Election Day httpstcomEQLWJV3 Yx,"{'neg': 0.0, 'neu': 1.0, 'pos': 0.0, 'compound': 0.0}",0.0,1.0,0.0,0.0,Trump
1004,1.31708e+18,RT @TheBabylonBee: President Trump Declares The Babylon Bee His Most-Trusted News Source https://t.co/oObdxaH3w6,https://twitter.com/A8420S/status/1317080163818086406,16/10/2020 12:29,1602850000000.0,1.18058e+18,A8420S,A8420S,,,,,,1.31707e+18,,-6,RT President Trump Declares The Babylon Bee His Most Trusted News Source httpstcoo ObdxaH3w6,"{'neg': 0.0, 'neu': 0.793, 'pos': 0.207, 'compound': 0.5256}",0.5256,0.793,0.207,0.0,Trump
1005,1.31708e+18,RT @gtconway3d: It's amazing how much contempt @realDonaldTrump's own aides have for him.,https://twitter.com/NancyKlapak/status/1317080163654402054,16/10/2020 12:29,1602850000000.0,1418593225.0,Nancy Klapak,NancyKlapak,"Arizona, USA",,,,,1.31694e+18,,-33,RT Its amazing much contempt aides,"{'neg': 0.328, 'neu': 0.345, 'pos': 0.328, 'compound': 0.0}",0.0,0.345,0.328,0.328,Trump
1006,1.31708e+18,Trump quote christelijke satirische site als nieuwsbron.,https://twitter.com/wilcodelange/status/1317080162979188737,16/10/2020 12:29,1602850000000.0,21704229.0,wilco de lange,wilcodelange,Ede,,,"Ede, Nederland",Nederland,,,-6,Trump quote christelijke satirische site als nieuwsbron,"{'neg': 0.0, 'neu': 1.0, 'pos': 0.0, 'compound': 0.0}",0.0,1.0,0.0,0.0,Trump
1009,1.31708e+18,"@AriFleischer Right, because trump WONT OR CANT answer a question. So you have to keep asking the same question over and over",https://twitter.com/1god2golf/status/1317080163943940096,16/10/2020 12:29,1602850000000.0,7.55439e+17,JEFF,1god2golf,"Massachusetts, USA",,,,,,1.3169e+18,20,Right trump WONT OR CANT answer question So keep asking question,"{'neg': 0.0, 'neu': 1.0, 'pos': 0.0, 'compound': 0.0}",0.0,1.0,0.0,0.0,Trump
1012,1.31708e+18,"RT @Timcast: In other news Trump falls for a Babylon Bee article

i love 2020",https://twitter.com/KathySueHurt1/status/1317080161771261957,16/10/2020 12:29,1602850000000.0,9.38737e+17,Kathy Sue Cox,KathySueHurt1,"Kentucky, USA",,,,,1.31705e+18,,-28,RT In news Trump falls Babylon Bee articlei love 2020,"{'neg': 0.0, 'neu': 0.682, 'pos': 0.318, 'compound': 0.6369}",0.6369,0.682,0.318,0.0,Trump
1015,1.31708e+18,"RT @funder: Network YouTube views as of 9pm

Biden: 507,445 ABC
Trump: 153,660 NBC",https://twitter.com/laxman0212/status/1317080167173545984,16/10/2020 12:29,1602850000000.0,374656490.0,Alex,laxman0212,"Columbus, Ohio",,,,,1.31708e+18,,-28,RT Network You Tube views 9pm Biden 507445 ABC Trump 153660 NBC,"{'neg': 0.0, 'neu': 1.0, 'pos': 0.0, 'compound': 0.0}",0.0,1.0,0.0,0.0,Trump
1016,1.31708e+18,"RT @MrMichaelBurkes: Give me a ""Trump 2020"" if you're voting for Trump in 19 days.",https://twitter.com/RustyParker15/status/1317080167206903808,16/10/2020 12:29,1602850000000.0,1.16234e+18,Rusty Parker,RustyParker15,"Cullman, AL",,,,,1.31688e+18,,53,RT Give Trump 2020 youre voting Trump 19 days,"{'neg': 0.0, 'neu': 1.0, 'pos': 0.0, 'compound': 0.0}",0.0,1.0,0.0,0.0,Trump
1017,1.31708e+18,RT @hodgetwins: This tweet goes out to the woman nodding for Trump. Retweet this so she sees it. She deserves a medal.,https://twitter.com/Qoe1Sondra/status/1317080167328718848,16/10/2020 12:29,1602850000000.0,1.20205e+18,SondraQOE1,Qoe1Sondra,"Texas, USA",,,,,1.3169e+18,,-34,RT This tweet goes woman nodding Trump Retweet sees She deserves medal,"{'neg': 0.0, 'neu': 0.78, 'pos': 0.22, 'compound': 0.4767}",0.4767,0.78,0.22,0.0,Trump
1018,1.31708e+18,"RT @FoxNews: Audience member nodding along with Trump during NBC town hall goes viral

https://t.co/Dd0iWz1C0c",https://twitter.com/vidarpedersen15/status/1317080167337132035,16/10/2020 12:29,1602850000000.0,1.18014e+18,vidar pedersen,vidarpedersen15,Norway,,,,,1.31708e+18,,-17,RT Audience member nodding along Trump NBC town hall goes viralhttpstco Dd0i Wz1C0c,"{'neg': 0.0, 'neu': 1.0, 'pos': 0.0, 'compound': 0.0}",0.0,1.0,0.0,0.0,Trump
1022,1.31708e+18,"RT @usambovu: #BREAKING : Minnesota department of health:  342 Covid 19 cases in Minnesota has been linked to Trump's Rally 

 #MorningJoe",https://twitter.com/LMvoteBlue/status/1317080167760551936,16/10/2020 12:29,1602850000000.0,1.24479e+18,LM - Fire Chuck Todd 🌊🌊🌊,LMvoteBlue,"Los Angeles, CA",,,,,1.31671e+18,,45,RT BREAKING Minnesota department health 342 Covid 19 cases Minnesota linked Trumps Rally Morning Joe,"{'neg': 0.0, 'neu': 1.0, 'pos': 0.0, 'compound': 0.0}",0.0,1.0,0.0,0.0,Trump
1024,1.31708e+18,RT @MattWalshBlog: Can we just focus on the fact that leftists doxxed a woman for sitting behind Trump and nodding during his town hall,https://twitter.com/Susan58128393/status/1317080167999819776,16/10/2020 12:29,1602850000000.0,7.91765e+17,Susan,Susan58128393,,,,,,1.31707e+18,,-41,RT Can focus fact leftists doxxed woman sitting behind Trump nodding town hall,"{'neg': 0.0, 'neu': 1.0, 'pos': 0.0, 'compound': 0.0}",0.0,1.0,0.0,0.0,Trump
1025,1.31708e+18,"RT @angrymaxfuryst: ""Biden voters have tiny dicks and can't get laid and are also gay""

Trump voters: https://t.co/vEQKEQf9cm",https://twitter.com/dingledodie77/status/1317080167899140096,16/10/2020 12:29,1602850000000.0,111676932.0,♥️♠️ Evelyn ♦️♣️,dingledodie77,Scotland,,,,,1.31708e+18,,47,RT Biden voters tiny dicks cant get laid also gay Trump voters httpstcovEQKE Qf9cm,"{'neg': 0.0, 'neu': 1.0, 'pos': 0.0, 'compound': 0.0}",0.0,1.0,0.0,0.0,Trump
1032,1.31708e+18,"RT @RealLPoslaiko: When the smoke clears, Pelosi impeached Trump for what Biden &amp; son actually did! https://t.co/RGGO1Ij2cx",https://twitter.com/planb_usa/status/1317080171313352704,16/10/2020 12:29,1602850000000.0,138443218.0,Da Prat,planb_usa,United States,,,,,1.31702e+18,,-55,RT When smoke clears Pelosi impeached Trump Biden amp son actually httpstcoRGGO1 Ij2cx,"{'neg': 0.0, 'neu': 0.902, 'pos': 0.098, 'compound': 0.0772}",0.0772,0.902,0.098,0.0,Trump
1033,1.31708e+18,"RT @HillaryClinton: The fact is that Donald Trump has no plan for this.

@JoeBiden does. 

https://t.co/JSx3WOS9sB",https://twitter.com/ABQMcD/status/1317080171296354309,16/10/2020 12:29,1602850000000.0,1.14909e+18,Lauren McDougall,ABQMcD,"Albuquerque, NM",,,,,1.31681e+18,,-8,RT The fact Donald Trump plan httpstcoJ Sx3WOS9sB,"{'neg': 0.0, 'neu': 1.0, 'pos': 0.0, 'compound': 0.0}",0.0,1.0,0.0,0.0,Trump
1034,1.31708e+18,RT @TMZ: Tommy Lee Swears He's Moving to Europe if Trump Wins Reelection https://t.co/8kjehbLvxV,https://twitter.com/HrBalla/status/1317080171481092096,16/10/2020 12:29,1602850000000.0,1973873155.0,Heather Reid 27✊🏾,HrBalla,,,,,,1.31682e+18,,-41,RT Tommy Lee Swears Hes Moving Europe Trump Wins Reelection httpstco8kjehb LvxV,"{'neg': 0.0, 'neu': 0.671, 'pos': 0.329, 'compound': 0.5994}",0.5994,0.671,0.329,0.0,Trump
1042,1.31708e+18,"RT @BeautyBind: And then announced she was voting for Biden. 

I hope Trump has tissues.",https://twitter.com/Art7767335429/status/1317080172370251778,16/10/2020 12:29,1602850000000.0,1.30413e+18,Art77,Art7767335429,,,,,,1.31708e+18,,-34,RT And announced voting Biden I hope Trump tissues,"{'neg': 0.0, 'neu': 0.707, 'pos': 0.293, 'compound': 0.4404}",0.4404,0.707,0.293,0.0,Trump
1044,1.31708e+18,"RT @JenniferLinn17: trump on NBC: 153,660 viewers 
Biden on ABC:  507,445 viewers",https://twitter.com/skymarkeer/status/1317080172592570374,16/10/2020 12:29,1602850000000.0,30745312.0,kpm,skymarkeer,"St Louis, MO",,,,,1.31698e+18,,-53,RT trump NBC 153660 viewers Biden ABC 507445 viewers,"{'neg': 0.0, 'neu': 1.0, 'pos': 0.0, 'compound': 0.0}",0.0,1.0,0.0,0.0,Trump
1047,1.31708e+18,"RT @PalmerReport: I'm one of Donald Trump's biggest critics, and even I didn't think Trump could fuck up as badly as he did tonight.",https://twitter.com/lynnsations/status/1317080175562149890,16/10/2020 12:29,1602850000000.0,1.04584e+18,Lynnsations,lynnsations,,,,,,1.31693e+18,,-4,RT Im one Donald Trumps biggest critics even I didnt think Trump could fuck badly tonight,"{'neg': 0.423, 'neu': 0.577, 'pos': 0.0, 'compound': -0.8316}",-0.8316,0.577,0.0,0.423,Trump
1051,1.31708e+18,"RT @funder: Network YouTube views as of 9pm

Biden: 507,445 ABC
Trump: 153,660 NBC",https://twitter.com/Katj512/status/1317080176187052032,16/10/2020 12:29,1602850000000.0,2165052054.0,"Mr. Vice President, I'm speaking",Katj512,"Texas, USA",,,,,1.31708e+18,,-28,RT Network You Tube views 9pm Biden 507445 ABC Trump 153660 NBC,"{'neg': 0.0, 'neu': 1.0, 'pos': 0.0, 'compound': 0.0}",0.0,1.0,0.0,0.0,Trump
1055,1.31708e+18,RT @realDonaldTrump: Thank you!,https://twitter.com/Cub33Q/status/1317080176266792960,16/10/2020 12:29,1602850000000.0,1.04246e+18,CubCub33,Cub33Q,United States of America,,,,,1.31704e+18,,-7,RT Thank,"{'neg': 0.0, 'neu': 0.286, 'pos': 0.714, 'compound': 0.3612}",0.3612,0.286,0.714,0.0,Trump
1057,1.31708e+18,RT @DrJasonJohnson: Trump thinks Black Men are Stupid that's why he met with Ice Cube. https://t.co/xmOwT5T3dB,https://twitter.com/MaggieChavarri5/status/1317080176249966593,16/10/2020 12:29,1602850000000.0,8.97866e+17,Maggie Chavarria🇭🇹,MaggieChavarri5,Southwest Florida,,,,,1.31689e+18,,-12,RT Trump thinks Black Men Stupid thats met Ice Cube httpstcoxm OwT5T3dB,"{'neg': 0.236, 'neu': 0.764, 'pos': 0.0, 'compound': -0.5267}",-0.5267,0.764,0.0,0.236,Trump
1061,1.31708e+18,"RT @KristiNoem: While Savannah Guthrie debates @realDonaldTrump, George Stephanopoulos is playing patty-cake with Biden.",https://twitter.com/Pedal2DMetals/status/1317080176770113536,16/10/2020 12:29,1602850000000.0,2856066637.0,UGA Dawg ⭐️⭐️⭐️,Pedal2DMetals,"Valdosta, GA",,,,,1.3169e+18,,-53,RT While Savannah Guthrie debates George Stephanopoulos playing pattycake Biden,"{'neg': 0.0, 'neu': 0.833, 'pos': 0.167, 'compound': 0.2023}",0.2023,0.833,0.167,0.0,Trump
1064,1.31708e+18,@DavidNakamura Trump is right !,https://twitter.com/LRrenn/status/1317080177076219905,16/10/2020 12:29,1602850000000.0,8.79846e+17,Lois Rrenn,LRrenn,,,,,,,1.31675e+18,2,Trump right,"{'neg': 0.0, 'neu': 1.0, 'pos': 0.0, 'compound': 0.0}",0.0,1.0,0.0,0.0,Trump
1066,1.31708e+18,"RT @funder: Network YouTube views as of 9pm

Biden: 507,445 ABC
Trump: 153,660 NBC",https://twitter.com/jp_burnett/status/1317080179840307200,16/10/2020 12:29,1602850000000.0,519658491.0,Jeanpaul Burnett,jp_burnett,"Jacksonville, FL",,,,,1.31708e+18,,-28,RT Network You Tube views 9pm Biden 507445 ABC Trump 153660 NBC,"{'neg': 0.0, 'neu': 1.0, 'pos': 0.0, 'compound': 0.0}",0.0,1.0,0.0,0.0,Trump
1068,1.31708e+18,this is what happens when you assume Trump cares about you,https://twitter.com/debrahatesdonal/status/1317080179706155009,16/10/2020 12:29,1602850000000.0,8.22494e+17,debra hall,debrahatesdonal,,,,,,,,-27,happens assume Trump cares,"{'neg': 0.0, 'neu': 0.5, 'pos': 0.5, 'compound': 0.4588}",0.4588,0.5,0.5,0.0,Trump
1070,1.31708e+18,"RT @AliVelshi: GOP Sen. Sasse unleashes scathing attack on Trump, 'TV-obsessed' narcissist https://t.co/1nERYdPoXn",https://twitter.com/eyeofthegoddess/status/1317080180016427008,16/10/2020 12:29,1602850000000.0,381829318.0,Debbie Russell #KHive #TeamJaime,eyeofthegoddess,DemCastMD,,,,,1.31708e+18,,-18,RT GOP Sen Sasse unleashes scathing attack Trump T Vobsessed narcissist httpstco1nER Yd Po Xn,"{'neg': 0.358, 'neu': 0.642, 'pos': 0.0, 'compound': -0.7717}",-0.7717,0.642,0.0,0.358,Trump
1071,1.31708e+18,"RT @thebradfordfile: OMG. There is a woman behind Trump nodding in agreement when he answers every question. 

I love it.",https://twitter.com/PattiSwfl/status/1317080179953500161,16/10/2020 12:29,1602850000000.0,7.89436e+17,PM,PattiSwfl,"Florida, USA",,,,,1.3169e+18,,-18,RT OMG There woman behind Trump nodding agreement answers every question I love,"{'neg': 0.0, 'neu': 0.575, 'pos': 0.425, 'compound': 0.8126}",0.8126,0.575,0.425,0.0,Trump
1075,1.31708e+18,Who thinks Trump called in a favor to shut down Twitter last night?,https://twitter.com/John_Beckham14/status/1317080180545015809,16/10/2020 12:29,1602850000000.0,9.88828e+17,Todd B,John_Beckham14,"Virginia, USA",,,,,,,-22,Who thinks Trump called favor shut Twitter last night,"{'neg': 0.0, 'neu': 0.748, 'pos': 0.252, 'compound': 0.4019}",0.4019,0.748,0.252,0.0,Trump
1078,1.31708e+18,"RT @RealJamesWoods: President Trump served this nation well, when he fired you after a week on the job.",https://twitter.com/rs2orlando/status/1317080180674990082,16/10/2020 12:29,1602850000000.0,3245154826.0,@RideshareFan🇺🇸🐸,rs2orlando,,,,,,1.31696e+18,,-16,RT President Trump served nation well fired week job,"{'neg': 0.283, 'neu': 0.551, 'pos': 0.165, 'compound': -0.3612}",-0.3612,0.551,0.165,0.283,Trump
1081,1.31708e+18,RT @anthonyvclark20: I wish we hated the system that led to Trump as much as we hate Trump......,https://twitter.com/nklf0621/status/1317080180859469824,16/10/2020 12:29,1602850000000.0,1.10549e+18,Nic,nklf0621,,,,,,1.31679e+18,,-69,RT I wish hated system led Trump much hate Trump,"{'neg': 0.476, 'neu': 0.361, 'pos': 0.163, 'compound': -0.7351}",-0.7351,0.361,0.163,0.476,Trump
1085,1.31708e+18,SHE BROUGHT a hatchet Trump brought a chain saw. Shredded her #fakenews lies.,https://twitter.com/BarryHart7/status/1317080183925506050,16/10/2020 12:29,1602850000000.0,860110616.0,Barry Hart,BarryHart7,Clearwater,,,,,,,-25,SHE BROUGHT hatchet Trump brought chain saw Shredded fakenews lies,"{'neg': 0.237, 'neu': 0.763, 'pos': 0.0, 'compound': -0.4215}",-0.4215,0.763,0.0,0.237,Trump
1086,1.31708e+18,"RT @FoxNews: Audience member nodding along with Trump during NBC town hall goes viral

https://t.co/Dd0iWz1C0c",https://twitter.com/godlymom5/status/1317080184269529089,16/10/2020 12:29,1602850000000.0,82967214.0,Erin Binder,godlymom5,"Largo, FL",,,,,1.31708e+18,,-17,RT Audience member nodding along Trump NBC town hall goes viralhttpstco Dd0i Wz1C0c,"{'neg': 0.0, 'neu': 1.0, 'pos': 0.0, 'compound': 0.0}",0.0,1.0,0.0,0.0,Trump
1087,1.31708e+18,"@ProjectLincoln Right! a vote for Biden is actually a vote for her.. as in his ""VP"" running mate.

#AllLivesMatter #Trump2020",https://twitter.com/wpeters3921/status/1317080184235884545,16/10/2020 12:29,1602850000000.0,7.50856e+17,Willard Peterson,wpeters3921,,,,,,,1.31707e+18,68,Right vote Biden actually vote VP running mate All Lives Matter Trump2020,"{'neg': 0.0, 'neu': 0.909, 'pos': 0.091, 'compound': 0.0258}",0.0258,0.909,0.091,0.0,Trump
1088,1.31708e+18,RT @ChuckCallesto: BREAKING REPORT: Feds investigating if alleged Hunter Biden emails CONNECTED TO FOREIGN INTELLIGENCE operation...,https://twitter.com/TroyKessler20/status/1317080184147890177,16/10/2020 12:29,1602850000000.0,1.23105e+18,Troy Kessler,TroyKessler20,,,,,,1.31695e+18,,-1,RT BREAKING REPORT Feds investigating alleged Hunter Biden emails CONNECTED TO FOREIGN INTELLIGENCE operation,"{'neg': 0.0, 'neu': 0.772, 'pos': 0.228, 'compound': 0.5904}",0.5904,0.772,0.228,0.0,Trump
1089,1.31708e+18,RT @MaryLTrump: Actually . . .,https://twitter.com/ninjakitty009/status/1317080184315613188,16/10/2020 12:29,1602850000000.0,21162560.0,LL Cool G,ninjakitty009,,,,,,1.3169e+18,,-54,RT Actually,"{'neg': 0.0, 'neu': 1.0, 'pos': 0.0, 'compound': 0.0}",0.0,1.0,0.0,0.0,Trump
1090,1.31708e+18,RT @ACTBrigitte: Retweet if President Trump won that debate.,https://twitter.com/UKExpat4MAGA/status/1317080184349167617,16/10/2020 12:29,1602850000000.0,1.02032e+18,UKExpat4Trump,UKExpat4MAGA,"Cincinnati, OH",,,,,1.31691e+18,,-15,RT Retweet President Trump debate,"{'neg': 0.0, 'neu': 1.0, 'pos': 0.0, 'compound': 0.0}",0.0,1.0,0.0,0.0,Trump
1096,1.31708e+18,@greggutfeld Poor little baby Trump got asked questions waaaaaaah,https://twitter.com/JDincauze/status/1317080184823140353,16/10/2020 12:29,1602850000000.0,186351244.0,J Dinkhouse,JDincauze,"Manhattan, NY",,,,,,1.3169e+18,-41,Poor little baby Trump got asked questions waaaaaaah,"{'neg': 0.307, 'neu': 0.693, 'pos': 0.0, 'compound': -0.4767}",-0.4767,0.693,0.0,0.307,Trump
1103,1.31708e+18,"RT @funder: Network YouTube views as of 9pm

Biden: 507,445 ABC
Trump: 153,660 NBC",https://twitter.com/mucketymucks/status/1317080188119900164,16/10/2020 12:29,1602850000000.0,386513005.0,Angela,mucketymucks,Philadelphia,,,,,1.31708e+18,,-28,RT Network You Tube views 9pm Biden 507445 ABC Trump 153660 NBC,"{'neg': 0.0, 'neu': 1.0, 'pos': 0.0, 'compound': 0.0}",0.0,1.0,0.0,0.0,Trump
1105,1.31708e+18,"RT @funder: Network YouTube views as of 9pm

Biden: 507,445 ABC
Trump: 153,660 NBC",https://twitter.com/zonedfortruth/status/1317080188279263232,16/10/2020 12:29,1602850000000.0,1.21974e+18,joni,zonedfortruth,,,,,,1.31708e+18,,-28,RT Network You Tube views 9pm Biden 507445 ABC Trump 153660 NBC,"{'neg': 0.0, 'neu': 1.0, 'pos': 0.0, 'compound': 0.0}",0.0,1.0,0.0,0.0,Trump
1106,1.31708e+18,RT @TheBabylonBee: President Trump Declares The Babylon Bee His Most-Trusted News Source https://t.co/oObdxaH3w6,https://twitter.com/rcrisanto1/status/1317080188413382660,16/10/2020 12:29,1602850000000.0,3196355311.0,rcrisanto,rcrisanto1,"Los Angeles, CA",,,,,1.31707e+18,,-6,RT President Trump Declares The Babylon Bee His Most Trusted News Source httpstcoo ObdxaH3w6,"{'neg': 0.0, 'neu': 0.793, 'pos': 0.207, 'compound': 0.5256}",0.5256,0.793,0.207,0.0,Trump
1107,1.31708e+18,@PalmerReport https://t.co/Po8c22Bs7n,https://twitter.com/MrBNisIndian/status/1317080188392509440,16/10/2020 12:29,1602850000000.0,1.30565e+18,Balan,MrBNisIndian,,,,,,,1.31694e+18,-11,httpstco Po8c22 Bs7n,"{'neg': 0.0, 'neu': 1.0, 'pos': 0.0, 'compound': 0.0}",0.0,1.0,0.0,0.0,Trump
1108,1.31708e+18,Trump Didn't Call Neo-Nazis 'Fine People.' Here's Proof.  https://t.co/y7luPIwAcP,https://twitter.com/nominaltomcat/status/1317080188468056065,16/10/2020 12:29,1602850000000.0,475743807.0,Thomas Loscar,nominaltomcat,,,,,,,,59,Trump Didnt Call Neo Nazis Fine People Heres Proof httpstcoy7luP Iw AcP,"{'neg': 0.0, 'neu': 0.859, 'pos': 0.141, 'compound': 0.2023}",0.2023,0.859,0.141,0.0,Trump
1110,1.31708e+18,"RT @ACampaNajjar: Trump is WRONG on this. @DarrellIssa, still going to excuse this? https://t.co/iKnWzxr1Da",https://twitter.com/ladybugg829Rcla/status/1317080188644151296,16/10/2020 12:29,1602850000000.0,2912860323.0,Rebecca Cunningham,ladybugg829Rcla,,,,,,1.31695e+18,,-27,RT Trump WRONG still going excuse httpstcoi Kn Wzxr1 Da,"{'neg': 0.292, 'neu': 0.609, 'pos': 0.099, 'compound': -0.5473}",-0.5473,0.609,0.099,0.292,Trump
1111,1.31708e+18,RT @UrbanAchievr: Crazy Uncle Trump thinks the Babylon Bee is real https://t.co/YBwLQDz18k,https://twitter.com/drwhovy/status/1317080188757434370,16/10/2020 12:29,1602850000000.0,318825740.0,Gerald W. Kuchera,drwhovy,"Detroit, MI",,,,,1.31705e+18,,-15,RT Crazy Uncle Trump thinks Babylon Bee real httpstcoY BwLQ Dz18k,"{'neg': 0.194, 'neu': 0.806, 'pos': 0.0, 'compound': -0.34}",-0.34,0.806,0.0,0.194,Trump
1112,1.31708e+18,RT @ArseneFlipo: @Alexis_Cossette @MartineCazes @lapierre_eve Alexis sur @SudRadio #Trump https://t.co/JvnLIL4Z8L,https://twitter.com/languillem/status/1317080188782579714,16/10/2020 12:29,1602850000000.0,904349491.0,ludimi Matr 111,languillem,france,,,,,1.31707e+18,,9,RT Alexis sur Trump httpstco JvnLIL4Z8L,"{'neg': 0.0, 'neu': 1.0, 'pos': 0.0, 'compound': 0.0}",0.0,1.0,0.0,0.0,Trump
1113,1.31708e+18,"RT @RyanAFournier: The second debate:

President Trump vs. Savannah Guthrie",https://twitter.com/cottonpony/status/1317080188870676481,16/10/2020 12:29,1602850000000.0,26848626.0,Dawn M. Reese,cottonpony,"RT🚫Endorsement, List= Block",,,,,1.3169e+18,,-41,RT The second debate President Trump vs Savannah Guthrie,"{'neg': 0.0, 'neu': 1.0, 'pos': 0.0, 'compound': 0.0}",0.0,1.0,0.0,0.0,Trump
1115,1.31708e+18,INSANE: Joe Biden Supports Prepubescent Children Being Able to Change Their Gender (VIDEO) via @gatewaypundit https://t.co/REhlyDd4uj,https://twitter.com/TrappedInNorCal/status/1317080188706983937,16/10/2020 12:29,1602850000000.0,1.21394e+18,tweetyrealtor,TrappedInNorCal,,,,,,,,15,INSANE Joe Biden Supports Prepubescent Children Being Able Change Their Gender VIDEO via httpstcoR Ehly Dd4uj,"{'neg': 0.172, 'neu': 0.702, 'pos': 0.125, 'compound': -0.2342}",-0.2342,0.702,0.125,0.172,Trump
1116,1.31708e+18,"RT @Whateva691: To whom does trump owe $421,000,000?",https://twitter.com/hinklepa/status/1317080189113753602,16/10/2020 12:29,1602850000000.0,59151675.0,Patricia Hinkle,hinklepa,"Albany, NY",,,,,1.3167e+18,,-23,RT To trump owe 421000000,"{'neg': 0.0, 'neu': 1.0, 'pos': 0.0, 'compound': 0.0}",0.0,1.0,0.0,0.0,Trump
1120,1.31708e+18,"@realDonaldTrump @cspan Rudy is a Russian asset.

Rudy is a Russian asset.

Rudy is a Russian asset.

Trump is Putin's Useful Idiot.",https://twitter.com/TobiasMarkus3/status/1317080192679030784,16/10/2020 12:29,1602850000000.0,1.28962e+18,𝑻. 𝑴𝒂𝒓𝒌𝒖𝒔 (aka) 🇺🇸🌎,TobiasMarkus3,Philadelphia,,,,,,1.31708e+18,-35,Rudy Russian asset Rudy Russian asset Rudy Russian asset Trump Putins Useful Idiot,"{'neg': 0.152, 'neu': 0.369, 'pos': 0.479, 'compound': 0.7269}",0.7269,0.369,0.479,0.152,Trump
1121,1.31708e+18,RT @therecount: Registered Republican town hall participant compliments Trump's smile. https://t.co/phmZFjvtQH,https://twitter.com/takeitslowbro/status/1317080192553259008,16/10/2020 12:29,1602850000000.0,300622686.0,Alex,takeitslowbro,,,,,,1.31691e+18,,-18,RT Registered Republican town hall participant compliments Trumps smile httpstcophmZ FjvtQH,"{'neg': 0.0, 'neu': 0.634, 'pos': 0.366, 'compound': 0.6369}",0.6369,0.634,0.366,0.0,Trump
1122,1.31708e+18,"Trump is the symptom, the @GOP is the disease https://t.co/oDNFHQyzwy via @BostonGlobe",https://twitter.com/HoneyB_158/status/1317080192641323008,16/10/2020 12:29,1602850000000.0,7.98591e+17,E_McConville,HoneyB_158,,,,,,,,-19,Trump symptom disease httpstcooDNFH Qyzwy via,"{'neg': 0.0, 'neu': 1.0, 'pos': 0.0, 'compound': 0.0}",0.0,1.0,0.0,0.0,Trump
1123,1.31708e+18,"RT @RealJamesWoods: President Trump served this nation well, when he fired you after a week on the job.",https://twitter.com/Mandy55551/status/1317080192800600064,16/10/2020 12:29,1602850000000.0,1.04579e+18,Mandy,Mandy55551,,,,,,1.31696e+18,,-16,RT President Trump served nation well fired week job,"{'neg': 0.283, 'neu': 0.551, 'pos': 0.165, 'compound': -0.3612}",-0.3612,0.551,0.165,0.283,Trump
1128,1.31708e+18,"RT @ColoradoDavidSu: Trump is worse than a snake oil salesmen, he is a con. #Con",https://twitter.com/Phyllis37612285/status/1317080193090179073,16/10/2020 12:29,1602850000000.0,1.15089e+18,Phyllis Williams Vandergrift,Phyllis37612285,,,,,,1.31707e+18,,-27,RT Trump worse snake oil salesmen con Con,"{'neg': 0.307, 'neu': 0.693, 'pos': 0.0, 'compound': -0.4767}",-0.4767,0.693,0.0,0.307,Trump
1129,1.31708e+18,"Ice Cube helps Trump with Platinum Plan for black Americans, says campaign promptly used his input  https://t.co/5WJs7sCACO",https://twitter.com/BruceHagen/status/1317080193027235842,16/10/2020 12:29,1602850000000.0,64290676.0,brucehagen,BruceHagen,,,,,,,,-7,Ice Cube helps Trump Platinum Plan black Americans says campaign promptly used input httpstco5W Js7sCACO,"{'neg': 0.0, 'neu': 0.843, 'pos': 0.157, 'compound': 0.3818}",0.3818,0.843,0.157,0.0,Trump
1130,1.31708e+18,RT @MaryLTrump: Actually . . .,https://twitter.com/HiltTimothy/status/1317080193182408705,16/10/2020 12:29,1602850000000.0,1061248676.0,timbo,HiltTimothy,,,,,,1.3169e+18,,-54,RT Actually,"{'neg': 0.0, 'neu': 1.0, 'pos': 0.0, 'compound': 0.0}",0.0,1.0,0.0,0.0,Trump
1133,1.31708e+18,@realDonaldTrump Dump trump. No morality at all.,https://twitter.com/HeuvelZandra/status/1317080193203318786,16/10/2020 12:29,1602850000000.0,1.31558e+18,Zandra Heuvel,HeuvelZandra,,,,,,,1.31705e+18,4,Dump trump No morality,"{'neg': 0.706, 'neu': 0.294, 'pos': 0.0, 'compound': -0.5859}",-0.5859,0.294,0.0,0.706,Trump
1135,1.31708e+18,"RT @tonyschwartz: Ben Sasse excoriates Trump in a private call, doesn't have the courage to do so publicly. Craven cowardice.",https://twitter.com/AndBocce/status/1317080193304088577,16/10/2020 12:29,1602850000000.0,1615133156.0,Miss I (and Bocce Cat) #Resist,AndBocce,"Wauconda, IL",,,,,1.31688e+18,,-36,RT Ben Sasse excoriates Trump private call doesnt courage publicly Craven cowardice,"{'neg': 0.193, 'neu': 0.807, 'pos': 0.0, 'compound': -0.3875}",-0.3875,0.807,0.0,0.193,Trump
1136,1.31708e+18,"@brhodes Meh, Trump knows a hack when he sees one. You people are all the same.",https://twitter.com/Jimbo_Jones_CLE/status/1317080196323766275,16/10/2020 12:29,1602850000000.0,1.29853e+18,Not_Sure,Jimbo_Jones_CLE,"Ohio, USA",,,,,,1.31708e+18,-20,Meh Trump knows hack sees one You people,"{'neg': 0.157, 'neu': 0.843, 'pos': 0.0, 'compound': -0.0772}",-0.0772,0.843,0.0,0.157,Trump
1138,1.31708e+18,@realDonaldTrump The Trump campaign 2020. https://t.co/PkF9EhhHVG,https://twitter.com/duanecooper1963/status/1317080196575539201,16/10/2020 12:29,1602850000000.0,7.87852e+17,Duane Cooper,duanecooper1963,United States,,,,,,1.31706e+18,-3,The Trump campaign 2020 httpstco PkF9 EhhHVG,"{'neg': 0.0, 'neu': 1.0, 'pos': 0.0, 'compound': 0.0}",0.0,1.0,0.0,0.0,Trump
