,tweet_id,text,link,created_at,timestamp_ms,user_id,user_name,user_screen_name,user_location,geo,coordinates,place_full_name,place_country,retweeted_status_id,in_reply_to_status_id,sarcasm_value,processed_tweets,polarity_scores,compounded,neutral,positive,negative,candidate
2037,1.31708e+18,"RT @RealJamesWoods: President Trump served this nation well, when he fired you after a week on the job.",https://twitter.com/ThomasMBarlow1/status/1317080427392217088,16/10/2020 12:30,1602850000000.0,1.25601e+18,Me Thinks🇺🇲🇺🇲❤🇺🇲🇺🇲,ThomasMBarlow1,,,,,,1.31696e+18,,-16,RT President Trump served nation well fired week job,"{'neg': 0.283, 'neu': 0.551, 'pos': 0.165, 'compound': -0.3612}",-0.3612,0.551,0.165,0.283,Trump
2038,1.31708e+18,I am willing to use my tax savings from Trump to help move any one wanting to leave the country if Trump wins.,https://twitter.com/patrick26198655/status/1317080427476168706,16/10/2020 12:30,1602850000000.0,1.2863e+18,patrick,patrick26198655,,,,,,,,3,I willing use tax savings Trump help move one wanting leave country Trump wins,"{'neg': 0.068, 'neu': 0.568, 'pos': 0.364, 'compound': 0.7351}",0.7351,0.568,0.364,0.068,Trump
2039,1.31708e+18,"RT @funder: Network YouTube views as of 9pm

Biden: 507,445 ABC
Trump: 153,660 NBC",https://twitter.com/admeissner/status/1317080427501408257,16/10/2020 12:30,1602850000000.0,303926297.0,meissman,admeissner,United States,,,,,1.31708e+18,,-28,RT Network You Tube views 9pm Biden 507445 ABC Trump 153660 NBC,"{'neg': 0.0, 'neu': 1.0, 'pos': 0.0, 'compound': 0.0}",0.0,1.0,0.0,0.0,Trump
2046,1.31708e+18,#EricTrumpsUkraineScandal,https://twitter.com/joanne83davis/status/1317080428029816832,16/10/2020 12:30,1602850000000.0,22273608.0,Joanne Davis,joanne83davis,CT,,,"Fairfield, CT",United States,,,-19,Eric Trumps Ukraine Scandal,"{'neg': 0.492, 'neu': 0.508, 'pos': 0.0, 'compound': -0.4404}",-0.4404,0.508,0.0,0.492,Trump
2047,1.31708e+18,"RT @funder: Network YouTube views as of 9pm

Biden: 507,445 ABC
Trump: 153,660 NBC",https://twitter.com/LisaKaleesi/status/1317080427916611588,16/10/2020 12:30,1602850000000.0,2194918963.0,LisaKaleesi,LisaKaleesi,"Texas, USA",,,,,1.31708e+18,,-28,RT Network You Tube views 9pm Biden 507445 ABC Trump 153660 NBC,"{'neg': 0.0, 'neu': 1.0, 'pos': 0.0, 'compound': 0.0}",0.0,1.0,0.0,0.0,Trump
2048,1.31708e+18,RT @realDonaldTrump: Biden lied Pennsylvania!,https://twitter.com/dkg153/status/1317080427803287553,16/10/2020 12:30,1602850000000.0,7.53951e+17,Maggie,dkg153,,,,,,1.31706e+18,,-49,RT Biden lied Pennsylvania,"{'neg': 0.464, 'neu': 0.536, 'pos': 0.0, 'compound': -0.3818}",-0.3818,0.536,0.0,0.464,Trump
2049,1.31708e+18,RT @FranMFarber: @jfcarraway Call all of your friends and family and make sure they are voting for Trump. Vote at the polls.,https://twitter.com/tleger45/status/1317080427954319360,16/10/2020 12:30,1602850000000.0,1117691550.0,#tooktheredpill,tleger45,"Kentucky, USA",,,,,1.31707e+18,,-18,RT Call friends family make sure voting Trump Vote polls,"{'neg': 0.0, 'neu': 0.597, 'pos': 0.403, 'compound': 0.6597}",0.6597,0.597,0.403,0.0,Trump
2050,1.31708e+18,"RT @gtconway3d: This is fabulous.  They're just laughing at @realDonaldTrump, as we all should, and as the rest of the world already does.",https://twitter.com/matthewdyer97/status/1317080428029841409,16/10/2020 12:30,1602850000000.0,20823636.0,Matthew Dyer,matthewdyer97,"Detroit, MI",,,,,1.31688e+18,,43,RT This fabulous Theyre laughing rest world already,"{'neg': 0.0, 'neu': 0.476, 'pos': 0.524, 'compound': 0.765}",0.765,0.476,0.524,0.0,Trump
2053,1.31708e+18,RT @ACTBrigitte: Retweet if President Trump won that debate.,https://twitter.com/i_veryin/status/1317080431452446722,16/10/2020 12:30,1602850000000.0,1.30244e+18,IFindITVeryinT 🇺🇸🇺🇸🇺🇸,i_veryin,"Alabama, USA",,,,,1.31691e+18,,-15,RT Retweet President Trump debate,"{'neg': 0.0, 'neu': 1.0, 'pos': 0.0, 'compound': 0.0}",0.0,1.0,0.0,0.0,Trump
2056,1.31708e+18,"RT @TrumpJew: Biden just had a Town Hall for an hour and a half 

0 questions about Hunter or his corrupt foreign dealings",https://twitter.com/BGuarn/status/1317080431716597760,16/10/2020 12:30,1602850000000.0,1.24542e+18,Bob Guarn,BGuarn,"Florida, USA",,,,,1.31692e+18,,-76,RT Biden Town Hall hour half 0 questions Hunter corrupt foreign dealings,"{'neg': 0.0, 'neu': 1.0, 'pos': 0.0, 'compound': 0.0}",0.0,1.0,0.0,0.0,Trump
2058,1.31708e+18,RT @joshtpm: So apparently Trump comms team's closing message is 'Fuck Mr Rogers'.,https://twitter.com/ForCaribbean/status/1317080431762771968,16/10/2020 12:30,1602850000000.0,1.10148e+18,Suzette Seepersad-Osbern(she/her/hers),ForCaribbean,Lower East Side Manhattan ,,,,,1.31692e+18,,-9,RT So apparently Trump comms teams closing message Fuck Mr Rogers,"{'neg': 0.259, 'neu': 0.741, 'pos': 0.0, 'compound': -0.5423}",-0.5423,0.741,0.0,0.259,Trump
2060,1.31708e+18,"RT @gregolear: Is $432,000,000 a lot? It seems like a lot.

Wait, isn't that about what Trump owes his various creditors?",https://twitter.com/William55246980/status/1317080431649587200,16/10/2020 12:30,1602850000000.0,9.59546e+17,complicit,William55246980,New Hampshire ,,,,,1.31656e+18,,-16,RT Is 432000000 lot It seems like lot Wait isnt Trump owes various creditors,"{'neg': 0.0, 'neu': 0.839, 'pos': 0.161, 'compound': 0.3612}",0.3612,0.839,0.161,0.0,Trump
2061,1.31708e+18,@benshapiro Don't you understand satire? This is reversed psychology at it's best. Well done President Trump,https://twitter.com/Quentinos1112/status/1317080431964061698,16/10/2020 12:30,1602850000000.0,3687853095.0,Quentin,Quentinos1112,The Netherlands,,,,,,1.31707e+18,16,Dont understand satire This reversed psychology best Well done President Trump,"{'neg': 0.0, 'neu': 0.588, 'pos': 0.412, 'compound': 0.743}",0.743,0.588,0.412,0.0,Trump
2062,1.31708e+18,@aroberts3016 Correction: Discredited propaganda cartels have become completely irrelevant. This is the great achievement of the Trump Wave.,https://twitter.com/ernestdempsey/status/1317080431947284486,16/10/2020 12:30,1602850000000.0,115864368.0,Ernest Dempsey,ernestdempsey,,,,,,,1.31708e+18,-61,Correction Discredited propaganda cartels become completely irrelevant This great achievement Trump Wave,"{'neg': 0.268, 'neu': 0.493, 'pos': 0.239, 'compound': 0.1189}",0.1189,0.493,0.239,0.268,Trump
2066,1.31708e+18,RT @realDonaldTrump: Biden lied Pennsylvania! https://t.co/zmD8Ew0bmS,https://twitter.com/Shaunboyce5/status/1317080432379396096,16/10/2020 12:30,1602850000000.0,1.02711e+18,Quattro maga man🇺🇸🇺🇸🇺🇸🇺🇸🇮🇪🇮🇪🇮🇪,Shaunboyce5,Where i need to be,,,,,1.31706e+18,,-29,RT Biden lied Pennsylvania httpstcozmD8 Ew0bmS,"{'neg': 0.342, 'neu': 0.658, 'pos': 0.0, 'compound': -0.3818}",-0.3818,0.658,0.0,0.342,Trump
2069,1.31708e+18,"RT @LibsInAmerica: 5 takeaways from the dueling Trump and Biden town halls

https://t.co/RcXZXDHXnG",https://twitter.com/Lee62992263/status/1317080432735903744,16/10/2020 12:30,1602850000000.0,1.29879e+18,Lee,Lee62992263,,,,,,1.31708e+18,,-48,RT 5 takeaways dueling Trump Biden town hallshttpstco RcXZXDH XnG,"{'neg': 0.0, 'neu': 1.0, 'pos': 0.0, 'compound': 0.0}",0.0,1.0,0.0,0.0,Trump
2070,1.31708e+18,"RT @mmpadellan: In 19 days, we get to completely HUMILIATE trump with the biggest landslide in American history.",https://twitter.com/laxman0212/status/1317080432605908993,16/10/2020 12:30,1602850000000.0,374656490.0,Alex,laxman0212,"Columbus, Ohio",,,,,1.31675e+18,,-53,RT In 19 days get completely HUMILIATE trump biggest landslide American history,"{'neg': 0.292, 'neu': 0.708, 'pos': 0.0, 'compound': -0.6732}",-0.6732,0.708,0.0,0.292,Trump
2073,1.31708e+18,"RT @FoxNews: McEnany claims Twitter holding her 'at gunpoint' until she deletes New York Post's Hunter Biden report

https://t.co/5cHOglkWPI",https://twitter.com/390rocket/status/1317080435525124097,16/10/2020 12:30,1602850000000.0,2973096358.0,J Currah,390rocket,YLK,,,,,1.31669e+18,,-50,RT Mc Enany claims Twitter holding gunpoint deletes New York Posts Hunter Biden reporthttpstco5cH OglkWPI,"{'neg': 0.0, 'neu': 1.0, 'pos': 0.0, 'compound': 0.0}",0.0,1.0,0.0,0.0,Trump
2075,1.31708e+18,"RT @washingtonpost: Savannah Guthrie grilled Trump like few others have, taking the heat off NBC for its town hall https://t.co/qCyCNks09V",https://twitter.com/milpen26/status/1317080435734859776,16/10/2020 12:30,1602850000000.0,1187455164.0,Millie Pensack Lutz,milpen26,"Harrisburg, PA",,,,,1.31706e+18,,-50,RT Savannah Guthrie grilled Trump like others taking heat NBC town hall httpstcoq CyC Nks09V,"{'neg': 0.0, 'neu': 0.848, 'pos': 0.152, 'compound': 0.3612}",0.3612,0.848,0.152,0.0,Trump
2077,1.31708e+18,"RT @AliVelshi: GOP Sen. Sasse unleashes scathing attack on Trump, 'TV-obsessed' narcissist https://t.co/1nERYdPoXn",https://twitter.com/UncleOdit/status/1317080435621613568,16/10/2020 12:30,1602850000000.0,1319294520.0,Uncle Mark,UncleOdit,Michigan,,,,,1.31708e+18,,-18,RT GOP Sen Sasse unleashes scathing attack Trump T Vobsessed narcissist httpstco1nER Yd Po Xn,"{'neg': 0.358, 'neu': 0.642, 'pos': 0.0, 'compound': -0.7717}",-0.7717,0.642,0.0,0.358,Trump
2081,1.31708e+18,"RT @ProjectLincoln: During the closing days of the campaign, Donald Trump is attacking *checks notes* Twitter, C-Span, and Comcast?

Ok.",https://twitter.com/zaphodsbud/status/1317080435919388677,16/10/2020 12:30,1602850000000.0,39724652.0,Ford Prefect,zaphodsbud,The Key Stone state,,,,,1.31683e+18,,-7,RT During closing days campaign Donald Trump attacking checks notes Twitter C Span Comcast Ok,"{'neg': 0.174, 'neu': 0.698, 'pos': 0.128, 'compound': -0.2023}",-0.2023,0.698,0.128,0.174,Trump
2082,1.31708e+18,#TrumpIsALaughingStock,https://twitter.com/Momma_Krispy/status/1317080436032634882,16/10/2020 12:30,1602850000000.0,411098311.0,Kay_B 🚫🍊💩,Momma_Krispy,Chaos,,,,,,,-19,Trump IsA Laughing Stock,"{'neg': 0.0, 'neu': 0.484, 'pos': 0.516, 'compound': 0.4939}",0.4939,0.484,0.516,0.0,Trump
2086,1.31708e+18,"RT @HillaryClinton: The fact is that Donald Trump has no plan for this.

@JoeBiden does. 

https://t.co/JSx3WOS9sB",https://twitter.com/cancion_song/status/1317080436305088512,16/10/2020 12:30,1602850000000.0,1.24808e+18,Cancíon=Song,cancion_song,,,,,,1.31681e+18,,-8,RT The fact Donald Trump plan httpstcoJ Sx3WOS9sB,"{'neg': 0.0, 'neu': 1.0, 'pos': 0.0, 'compound': 0.0}",0.0,1.0,0.0,0.0,Trump
2088,1.31708e+18,@brianslionsblog Disagree with Trump and you're labeled a democrat,https://twitter.com/TheBigFoxx/status/1317080436489715713,16/10/2020 12:30,1602850000000.0,258049193.0,Jackie Daytona,TheBigFoxx,Inside of Pirlo’s mind,,,,,,1.31708e+18,14,Disagree Trump youre labeled democrat,"{'neg': 0.394, 'neu': 0.606, 'pos': 0.0, 'compound': -0.3818}",-0.3818,0.606,0.0,0.394,Trump
2090,1.31708e+18,"YES!!! I KNEW IT WOULD HAPPEN. 

Trump fell for an Onion type site!! Yay for satire",https://twitter.com/lackthereof1783/status/1317080436497993730,16/10/2020 12:30,1602850000000.0,223759942.0,Cody K,lackthereof1783,,,,,,,,45,YES I KNEW IT WOULD HAPPEN Trump fell Onion type site Yay satire,"{'neg': 0.0, 'neu': 0.594, 'pos': 0.406, 'compound': 0.7804}",0.7804,0.594,0.406,0.0,Trump
2091,1.31708e+18,RT @TheBabylonBee: President Trump Declares The Babylon Bee His Most-Trusted News Source https://t.co/oObdxaH3w6,https://twitter.com/deb64472205/status/1317080436556836864,16/10/2020 12:30,1602850000000.0,1.30883e+18,deb vote blue,deb64472205,"Hingham, MA",,,,,1.31707e+18,,-6,RT President Trump Declares The Babylon Bee His Most Trusted News Source httpstcoo ObdxaH3w6,"{'neg': 0.0, 'neu': 0.793, 'pos': 0.207, 'compound': 0.5256}",0.5256,0.793,0.207,0.0,Trump
2092,1.31708e+18,RT @realDonaldTrump: Biden lied Pennsylvania!,https://twitter.com/konaboy/status/1317080436573638656,16/10/2020 12:30,1602850000000.0,18588164.0,Joe,konaboy,new york,,,,,1.31706e+18,,-49,RT Biden lied Pennsylvania,"{'neg': 0.464, 'neu': 0.536, 'pos': 0.0, 'compound': -0.3818}",-0.3818,0.536,0.0,0.464,Trump
2093,1.31708e+18,@JumboUsa @JoeBiden LMAO YOU SAID LIAR. WEARING A TRUMP HAT... LLS LOL LMAO. NOW THAT'S FUNNY,https://twitter.com/nsu92don/status/1317080436783353857,16/10/2020 12:30,1602850000000.0,1.3006e+18,Nsu92don,nsu92don,"Pennsylvania, USA",,,,,,1.31682e+18,-33,LMAO YOU SAID LIAR WEARING A TRUMP HAT LLS LOL LMAO NOW THATS FUNNY,"{'neg': 0.133, 'neu': 0.323, 'pos': 0.544, 'compound': 0.8807}",0.8807,0.323,0.544,0.133,Trump
2094,1.31708e+18,@anniefreyshow Hope she got to speak to Trump!,https://twitter.com/LorraineCastal1/status/1317080438142271493,16/10/2020 12:30,1602850000000.0,1.2983e+18,Lorraine Castaldo,LorraineCastal1,,,,,,,1.31692e+18,-28,Hope got speak Trump,"{'neg': 0.0, 'neu': 0.508, 'pos': 0.492, 'compound': 0.4404}",0.4404,0.508,0.492,0.0,Trump
2095,1.31708e+18,RT @MaryLTrump: Actually . . .,https://twitter.com/JGMWill/status/1317080438226276352,16/10/2020 12:30,1602850000000.0,389015901.0,JMacDubs,JGMWill,,,,,,1.3169e+18,,-54,RT Actually,"{'neg': 0.0, 'neu': 1.0, 'pos': 0.0, 'compound': 0.0}",0.0,1.0,0.0,0.0,Trump
2097,1.31708e+18,"JOE BIDEN supported by Wall Street Americans!

PRESIDENT TRUMP supported by Main Street Americans!",https://twitter.com/Riot2Pat/status/1317080439765504002,16/10/2020 12:30,1602850000000.0,1.20515e+18,Pat Riot,Riot2Pat,,,,,,,,-53,JOE BIDEN supported Wall Street AmericansPRESIDENT TRUMP supported Main Street Americans,"{'neg': 0.0, 'neu': 0.662, 'pos': 0.338, 'compound': 0.5574}",0.5574,0.662,0.338,0.0,Trump
2098,1.31708e+18,RT @MaryLTrump: Actually . . .,https://twitter.com/Christe05174139/status/1317080440910602240,16/10/2020 12:30,1602850000000.0,1.11898e+18,Christeen,Christe05174139,,,,,,1.3169e+18,,-54,RT Actually,"{'neg': 0.0, 'neu': 1.0, 'pos': 0.0, 'compound': 0.0}",0.0,1.0,0.0,0.0,Trump
2099,1.31708e+18,"RT @joncoopertweets: Savannah Guthrie grilled Trump like few others have, taking the heat off NBC for its town hall  https://t.co/bgEEobDEct",https://twitter.com/mschroeder14212/status/1317080442919682049,16/10/2020 12:30,1602850000000.0,1.21094e+18,M Schroeder,mschroeder14212,,,,,,1.31707e+18,,-49,RT Savannah Guthrie grilled Trump like others taking heat NBC town hall httpstcobgE EobD Ect,"{'neg': 0.0, 'neu': 0.848, 'pos': 0.152, 'compound': 0.3612}",0.3612,0.848,0.152,0.0,Trump
2100,1.31708e+18,RT @ThePubliusUSA: The founders would have tried Donald Trump for treason.,https://twitter.com/lol_rukidnme/status/1317080438356271104,16/10/2020 12:30,1602850000000.0,2924758103.0,Debra Skiffington,lol_rukidnme,"Charlotte, NC",,,,,1.31708e+18,,-1,RT The founders would tried Donald Trump treason,"{'neg': 0.293, 'neu': 0.707, 'pos': 0.0, 'compound': -0.4404}",-0.4404,0.707,0.0,0.293,Trump
2103,1.31708e+18,RT @DFBHarvard: RETWEET If you believe Savannah Guthrie tried a hatchet job on President Trump last night! https://t.co/PqfZr0w5BM,https://twitter.com/msyoung2222/status/1317080442114367488,16/10/2020 12:30,1602850000000.0,2461228384.0,s. young🌟🌟🌟,msyoung2222,"Tennessee, USA",,,,,1.31707e+18,,-5,RT RETWEET If believe Savannah Guthrie tried hatchet job President Trump last night httpstco Pqf Zr0w5BM,"{'neg': 0.0, 'neu': 1.0, 'pos': 0.0, 'compound': 0.0}",0.0,1.0,0.0,0.0,Trump
2104,1.31708e+18,RT @1blantdaddy: That woman nodding behind Trump was 98% of America.,https://twitter.com/ChrisCletus6/status/1317080439014785025,16/10/2020 12:30,1602850000000.0,1.23706e+18,Chris Cletus,ChrisCletus6,,,,,,1.31707e+18,,-52,RT That woman nodding behind Trump 98 America,"{'neg': 0.0, 'neu': 1.0, 'pos': 0.0, 'compound': 0.0}",0.0,1.0,0.0,0.0,Trump
2105,1.31708e+18,RT @ChuckCallesto: BREAKING REPORT: Feds investigating if alleged Hunter Biden emails CONNECTED TO FOREIGN INTELLIGENCE operation...,https://twitter.com/sonasson/status/1317080439786557440,16/10/2020 12:30,1602850000000.0,96974356.0,Enoch 🇩🇰🇬🇧🇺🇸🇮🇱,sonasson,Copenhagen Denmark,,,,,1.31695e+18,,-1,RT BREAKING REPORT Feds investigating alleged Hunter Biden emails CONNECTED TO FOREIGN INTELLIGENCE operation,"{'neg': 0.0, 'neu': 0.772, 'pos': 0.228, 'compound': 0.5904}",0.5904,0.772,0.228,0.0,Trump
2106,1.31708e+18,RT @williamlegate: Trump's last 3 campaign managers have all been arrested.,https://twitter.com/AshleyChamberla/status/1317080441812361216,16/10/2020 12:30,1602850000000.0,385535552.0,Ashley Chamberlain,AshleyChamberla,"Paris, France {i wish}",,,,,1.31692e+18,,-16,RT Trumps last 3 campaign managers arrested,"{'neg': 0.383, 'neu': 0.617, 'pos': 0.0, 'compound': -0.4767}",-0.4767,0.617,0.0,0.383,Trump
2109,1.31708e+18,RT @Minuteman04: Republicans whining that Trump got bullied by Savannah Guthrie. No wonder he cowers before Putin.,https://twitter.com/votebymailman/status/1317080441388662785,16/10/2020 12:30,1602850000000.0,1.23428e+18,Ricardo Colón🇵🇷❤️☮️✊🏽,votebymailman,"Thibodaux, LA",,,,,1.31691e+18,,-16,RT Republicans whining Trump got bullied Savannah Guthrie No wonder cowers Putin,"{'neg': 0.477, 'neu': 0.523, 'pos': 0.0, 'compound': -0.802}",-0.802,0.523,0.0,0.477,Trump
2111,1.31708e+18,@Veteran4Trump @washingtonpost https://t.co/Ixb33cGWzF,https://twitter.com/LMT_Amanda/status/1317080442428936196,16/10/2020 12:30,1602850000000.0,615638874.0,Magaia,LMT_Amanda,"Oak Ridge, TN",,,"Oak Ridge, TN",United States,,1.31682e+18,-8,httpstco Ixb33cG WzF,"{'neg': 0.0, 'neu': 1.0, 'pos': 0.0, 'compound': 0.0}",0.0,1.0,0.0,0.0,Trump
2116,1.31708e+18,"RT @TVietor08: Trump on whether he owes money to foreign banks: ""Not that I know of....I mean probably""

That is the worst-possible answer.",https://twitter.com/DascenzoJj/status/1317080443703971845,16/10/2020 12:30,1602850000000.0,4104776038.0,jj,DascenzoJj,"Columbus, OH",,,,,1.3169e+18,,40,RT Trump whether owes money foreign banks Not I know ofI mean probably That worstpossible answer,"{'neg': 0.0, 'neu': 1.0, 'pos': 0.0, 'compound': 0.0}",0.0,1.0,0.0,0.0,Trump
2117,1.31708e+18,RT @RichardGrenell: People who only watch  @NBCNews are hearing some great Trump messaging for the first time.,https://twitter.com/MaureenMcKeon3/status/1317080443364233216,16/10/2020 12:30,1602850000000.0,1.13236e+18,Maureen McKeon,MaureenMcKeon3,NY Capital District,,,,,1.3169e+18,,16,RT People watch hearing great Trump messaging first time,"{'neg': 0.0, 'neu': 0.661, 'pos': 0.339, 'compound': 0.6249}",0.6249,0.661,0.339,0.0,Trump
2118,1.31708e+18,@pl6419 Braves Dodgers was more fun to watch than Trump.  Ball game had better ratings and viewership.,https://twitter.com/kog1/status/1317080444991668225,16/10/2020 12:30,1602850000000.0,51533350.0,kog1,kog1,,,,,,,1.31637e+18,-31,Braves Dodgers fun watch Trump Ball game better ratings viewership,"{'neg': 0.0, 'neu': 0.435, 'pos': 0.565, 'compound': 0.8442}",0.8442,0.435,0.565,0.0,Trump
2120,1.31708e+18,RT @TheEpicDept: President Trump's latest retweeted buddy https://t.co/rXj0uMrQte,https://twitter.com/JaimeRRocketSci/status/1317080444836380673,16/10/2020 12:30,1602850000000.0,114656648.0,Glavny Konstruktor 🚀🛰️🏴🚩🏴‍☠️🖖🏽,JaimeRRocketSci,NCC-1701,,,,,1.31693e+18,,-21,RT President Trumps latest retweeted buddy httpstcor Xj0u Mr Qte,"{'neg': 0.0, 'neu': 1.0, 'pos': 0.0, 'compound': 0.0}",0.0,1.0,0.0,0.0,Trump
2127,1.31708e+18,RT @TheBabylonBee: President Trump Declares The Babylon Bee His Most-Trusted News Source https://t.co/oObdxaH3w6,https://twitter.com/hbreyn/status/1317080447797678082,16/10/2020 12:30,1602850000000.0,1.27803e+18,Hannah,hbreyn,Canada,,,,,1.31707e+18,,-6,RT President Trump Declares The Babylon Bee His Most Trusted News Source httpstcoo ObdxaH3w6,"{'neg': 0.0, 'neu': 0.793, 'pos': 0.207, 'compound': 0.5256}",0.5256,0.793,0.207,0.0,Trump
2128,1.31708e+18,RT @real_defender: @realDonaldTrump Trump 2020 landslide. Who is with me?!,https://twitter.com/meanjean69330/status/1317080448217079810,16/10/2020 12:30,1602850000000.0,15102545.0,meanjean69330,meanjean69330,,,,,,1.31706e+18,,-16,RT Trump 2020 landslide Who,"{'neg': 0.0, 'neu': 1.0, 'pos': 0.0, 'compound': 0.0}",0.0,1.0,0.0,0.0,Trump
2130,1.31708e+18,RT @realTuckFrumper: Obama says Trump 'Doesn't Have the Patience' to Change U.S. Foreign Policy https://t.co/he9zHtWGFu,https://twitter.com/CK1gamer/status/1317080448288411655,16/10/2020 12:30,1602850000000.0,1138338044.0,"Stay inside, stay safe, BLM🏳️‍🌈",CK1gamer,,,,,,1.31701e+18,,28,RT Obama says Trump Doesnt Have Patience Change US Foreign Policy httpstcohe9z HtWG Fu,"{'neg': 0.266, 'neu': 0.734, 'pos': 0.0, 'compound': -0.6908}",-0.6908,0.734,0.0,0.266,Trump
2131,1.31708e+18,"@Alenaalex13 I need a boost, not a Biden boost from the media I need a Trump boost from Patriots!",https://twitter.com/GolfPro4444/status/1317080448649089024,16/10/2020 12:30,1602850000000.0,63578964.0,Stephan Carson,GolfPro4444,,,,,,,1.31708e+18,-33,I need boost Biden boost media I need Trump boost Patriots,"{'neg': 0.0, 'neu': 0.426, 'pos': 0.574, 'compound': 0.7964}",0.7964,0.426,0.574,0.0,Trump
2132,1.31708e+18,RT @JLCauvin: Donald Trump has commentary on the Biden Town Hall already! https://t.co/hGa8poEU0M,https://twitter.com/JillAnn1721/status/1317080448774868993,16/10/2020 12:30,1602850000000.0,1.24352e+18,Jill,JillAnn1721,"Yo-semite, Thighland",,,,,1.31691e+18,,-1,RT Donald Trump commentary Biden Town Hall already httpstcoh Ga8poEU0M,"{'neg': 0.0, 'neu': 1.0, 'pos': 0.0, 'compound': 0.0}",0.0,1.0,0.0,0.0,Trump
2133,1.31708e+18,RT @SohrabAhmari: Do NOT miss part two of our reporting on the Hunter files. https://t.co/JHPvMzHWbE,https://twitter.com/jgrzasko/status/1317080447986315264,16/10/2020 12:30,1602850000000.0,2984677078.0,Joshua Grzasko,jgrzasko,,,,,,1.3167e+18,,-25,RT Do NOT miss part two reporting Hunter files httpstcoJH Pv MzH WbE,"{'neg': 0.0, 'neu': 0.893, 'pos': 0.107, 'compound': 0.1139}",0.1139,0.893,0.107,0.0,Trump
2135,1.31708e+18,RT @ksorbs: The polls are lying. Who thinks Trump will win in a landslide?,https://twitter.com/jpthornton40/status/1317080448120520706,16/10/2020 12:30,1602850000000.0,494437471.0,Parker Thornton,jpthornton40,,,,,,1.31673e+18,,-26,RT The polls lying Who thinks Trump win landslide,"{'neg': 0.239, 'neu': 0.493, 'pos': 0.268, 'compound': 0.1027}",0.1027,0.493,0.268,0.239,Trump
2136,1.31708e+18,@C4CEO @TeamTrump This from a child molester. No wonder Hunter is a mess. How many times was he sniffed? https://t.co/Zk32LwilG5,https://twitter.com/gnu_penguin/status/1317080448435191810,16/10/2020 12:30,1602850000000.0,389867973.0,Gnu,gnu_penguin,Canada,,,"Stratford, Prince Edward Island",Canada,,1.31695e+18,-56,This child molester No wonder Hunter mess How many times sniffed httpstco Zk32 LwilG5,"{'neg': 0.421, 'neu': 0.579, 'pos': 0.0, 'compound': -0.7906}",-0.7906,0.579,0.0,0.421,Trump
2137,1.31708e+18,RT @IngrahamAngle: Has any media person ever challenged Biden like Savannah Guthrie is with Trump?,https://twitter.com/marywee07840815/status/1317080448544182272,16/10/2020 12:30,1602850000000.0,1.03852e+18,mary weeks,marywee07840815,,,,,,1.3169e+18,,-32,RT Has media person ever challenged Biden like Savannah Guthrie Trump,"{'neg': 0.109, 'neu': 0.698, 'pos': 0.194, 'compound': 0.2732}",0.2732,0.698,0.194,0.109,Trump
2138,1.31708e+18,Oga Come Defend Yourself Now! You No Dey See Trump? https://t.co/gswvk0JvUi,https://twitter.com/JOHNNY_CASH_197/status/1317080448183508992,16/10/2020 12:30,1602850000000.0,8.42888e+17,Rudolf Odohodi,JOHNNY_CASH_197,Uyo,,,,,,,-11,Oga Come Defend Yourself Now You No Dey See Trump httpstcogswvk0 Jv Ui,"{'neg': 0.155, 'neu': 0.845, 'pos': 0.0, 'compound': -0.296}",-0.296,0.845,0.0,0.155,Trump
2146,1.31717e+18,"RT @atrupar: Trump's coronavirus plan, in one 9 second clip https://t.co/NcEmTXvJAM",https://twitter.com/antiscarcity/status/1317174074838319105,16/10/2020 18:42,1602870000000.0,423195810.0,a̷n̷t̷i̷s͛cͨaͣrͬcͨiͥᴛⷮy 🧢 🇺🇸,antiscarcity,,,,,,1.31717e+18,,-27,RT Trumps coronavirus plan one 9 second clip httpstco Nc EmT XvJAM,"{'neg': 0.0, 'neu': 1.0, 'pos': 0.0, 'compound': 0.0}",0.0,1.0,0.0,0.0,Trump
2149,1.31717e+18,"RT @KristiNoem: While Savannah Guthrie debates @realDonaldTrump, George Stephanopoulos is playing patty-cake with Biden.",https://twitter.com/burlybutton/status/1317174075412938752,16/10/2020 18:42,1602870000000.0,947658558.0,sara gershon,burlybutton,,,,,,1.3169e+18,,-53,RT While Savannah Guthrie debates George Stephanopoulos playing pattycake Biden,"{'neg': 0.0, 'neu': 0.833, 'pos': 0.167, 'compound': 0.2023}",0.2023,0.833,0.167,0.0,Trump
2150,1.31717e+18,"RT @TrumpWarRoom: The son of billionaire George Soros just gave Joe Biden $145,000.
https://t.co/vKVwhik4Br",https://twitter.com/solesilvaturela/status/1317174075496779786,16/10/2020 18:42,1602870000000.0,2189022019.0,S. Chile,solesilvaturela,,,,,,1.31717e+18,,-25,RT The son billionaire George Soros gave Joe Biden 145000httpstcovK Vwhik4 Br,"{'neg': 0.0, 'neu': 1.0, 'pos': 0.0, 'compound': 0.0}",0.0,1.0,0.0,0.0,Trump
2157,1.31717e+18,RT @SenDuckworth: Donald Trump's 112-day silence on #BountyGate says more than words ever could.,https://twitter.com/66stilllliberal/status/1317174078063652866,16/10/2020 18:42,1602870000000.0,840713616.0,RebeccaCoheaLane,66stilllliberal,,,,,,1.3171e+18,,2,RT Donald Trumps 112day silence Bounty Gate says words ever could,"{'neg': 0.0, 'neu': 1.0, 'pos': 0.0, 'compound': 0.0}",0.0,1.0,0.0,0.0,Trump
2162,1.31717e+18,RT @jdmaccoby: Trump showed he can lose a debate all by himself,https://twitter.com/FayeSto00103109/status/1317174078478950400,16/10/2020 18:42,1602870000000.0,1.31206e+18,FayeStone,FayeSto00103109,,,,,,1.31709e+18,,-50,RT Trump showed lose debate,"{'neg': 0.403, 'neu': 0.597, 'pos': 0.0, 'compound': -0.4019}",-0.4019,0.597,0.0,0.403,Trump
2163,1.31717e+18,Sick sleepy Joe.   REELECT PRESIDENT TRUMP #CorruptJoeBiden #BidenHarris,https://twitter.com/terrasoul2/status/1317174078378332161,16/10/2020 18:42,1602870000000.0,6.98335e+17,terrasoul,terrasoul2,,,,,,,,-18,Sick sleepy Joe REELECT PRESIDENT TRUMP Corrupt Joe Biden Biden Harris,"{'neg': 0.248, 'neu': 0.752, 'pos': 0.0, 'compound': -0.5106}",-0.5106,0.752,0.0,0.248,Trump
