,tweet_id,text,link,created_at,timestamp_ms,user_id,user_name,user_screen_name,user_location,geo,coordinates,place_full_name,place_country,retweeted_status_id,in_reply_to_status_id,sarcasm_value,processed_tweets,polarity_scores,compounded,neutral,positive,negative,candidate
3315,1.31717e+18,RT @tytsports: Angry Trump Supporter Coughs On BLM Protesters - @rickstrom https://t.co/gnlBelilsV,https://twitter.com/Unsatisfied_AF/status/1317174380452085760,16/10/2020 18:43,1602870000000.0,7.28398e+17,"John Henry ""Doc"" Holliday",Unsatisfied_AF,In a shining city on a hill,,,,,1.31683e+18,,11,RT Angry Trump Supporter Coughs On BLM Protesters httpstcognl BelilsV,"{'neg': 0.364, 'neu': 0.49, 'pos': 0.147, 'compound': -0.4767}",-0.4767,0.49,0.147,0.364,Trump
3318,1.31717e+18,"@nick_goldberg Great article in LaTimes this morning. In my opinion, trump is absolutely the worst-ever president.",https://twitter.com/ba1247555/status/1317174380661592064,16/10/2020 18:43,1602870000000.0,1.28534e+18,James Barnes,ba1247555,,,,,,,,2,Great article La Times morning In opinion trump absolutely worstever president,"{'neg': 0.0, 'neu': 0.709, 'pos': 0.291, 'compound': 0.6249}",0.6249,0.709,0.291,0.0,Trump
3323,1.31717e+18,RT @MargotLJParker: Facebook and Twitter Censorship Will Backfire and Help Trump's Campaign | Opinion https://t.co/jVOdtBOMuE,https://twitter.com/Yankeedemocrat/status/1317174383685894146,16/10/2020 18:43,1602870000000.0,131128626.0,Yankee Democrat,Yankeedemocrat,England,,,,,1.31717e+18,,34,RT Facebook Twitter Censorship Will Backfire Help Trumps Campaign Opinion httpstcojV OdtBO MuE,"{'neg': 0.0, 'neu': 0.816, 'pos': 0.184, 'compound': 0.4019}",0.4019,0.816,0.184,0.0,Trump
3327,1.31717e+18,RT @MaryLTrump: Actually . . .,https://twitter.com/msjbizzle/status/1317174384021352449,16/10/2020 18:43,1602870000000.0,1191982915.0,JB,msjbizzle,,,,,,1.3169e+18,,-54,RT Actually,"{'neg': 0.0, 'neu': 1.0, 'pos': 0.0, 'compound': 0.0}",0.0,1.0,0.0,0.0,Trump
3331,1.31717e+18,"RT @JenniferLinn17: trump on NBC: 153,660 viewers 
Biden on ABC:  507,445 viewers",https://twitter.com/brayllenn/status/1317174384784625664,16/10/2020 18:43,1602870000000.0,7.80434e+17,b,brayllenn,"Fairmont, NC",,,,,1.31698e+18,,-53,RT trump NBC 153660 viewers Biden ABC 507445 viewers,"{'neg': 0.0, 'neu': 1.0, 'pos': 0.0, 'compound': 0.0}",0.0,1.0,0.0,0.0,Trump
3333,1.31717e+18,RT @IngrahamAngle: Has any media person ever challenged Biden like Savannah Guthrie is with Trump?,https://twitter.com/FutureFred1/status/1317174384906268672,16/10/2020 18:43,1602870000000.0,1.04549e+18,FutureFred 🇺🇸,FutureFred1,"California, USA",,,,,1.3169e+18,,-32,RT Has media person ever challenged Biden like Savannah Guthrie Trump,"{'neg': 0.109, 'neu': 0.698, 'pos': 0.194, 'compound': 0.2732}",0.2732,0.698,0.194,0.109,Trump
3334,1.31717e+18,RT @DonaldJTrumpJr: This is a must watch and a must RT!!! https://t.co/mSdxsFfTPg,https://twitter.com/SmithDa49609487/status/1317174387842351105,16/10/2020 18:43,1602870000000.0,1.31717e+18,Smith David,SmithDa49609487,,,,,,1.31714e+18,,-28,RT This must watch must RT httpstcom Sdxs FfT Pg,"{'neg': 0.0, 'neu': 1.0, 'pos': 0.0, 'compound': 0.0}",0.0,1.0,0.0,0.0,Trump
3336,1.31717e+18,"@Diddy Yo Diddy! When Trump wins on Nov 3, I am coming back here to comment the following. ""Take that. Take that""",https://twitter.com/ricky_no_soy/status/1317174387980800007,16/10/2020 18:43,1602870000000.0,1.28533e+18,Ricky No Soy,ricky_no_soy,,,,,,,1.31711e+18,13,Yo Diddy When Trump wins Nov 3 I coming back comment following Take Take,"{'neg': 0.0, 'neu': 0.748, 'pos': 0.252, 'compound': 0.5719}",0.5719,0.748,0.252,0.0,Trump
3337,1.31717e+18,"@BetteMidler Trump's friends: Bezos, Murdoch, TBrady,T Woods, Koch industr ies brothers.",https://twitter.com/Victoria061152/status/1317174388018597888,16/10/2020 18:43,1602870000000.0,846188696.0,Victoria,Victoria061152,,,,,,,1.31691e+18,-30,Trumps friends Bezos Murdoch T BradyT Woods Koch industr ies brothers,"{'neg': 0.0, 'neu': 0.744, 'pos': 0.256, 'compound': 0.4767}",0.4767,0.744,0.256,0.0,Trump
3339,1.31717e+18,RT @williamlegate: Trump's last 3 campaign managers have all been arrested.,https://twitter.com/enzo_1089/status/1317174388010160129,16/10/2020 18:43,1602870000000.0,4270267523.0,clara pappas,enzo_1089,"Chicago, IL",,,,,1.31692e+18,,-16,RT Trumps last 3 campaign managers arrested,"{'neg': 0.383, 'neu': 0.617, 'pos': 0.0, 'compound': -0.4767}",-0.4767,0.617,0.0,0.383,Trump
3340,1.31717e+18,@Mike_Pence @realDonaldTrump thank God - we need socialized medicine.  Health care in America is a total mess.  Ridin' with Biden!,https://twitter.com/jacklauer8590/status/1317174387985055745,16/10/2020 18:43,1602870000000.0,2425932871.0,Jack,jacklauer8590,"Winston-Salem, NC",,,,,,1.31713e+18,-40,thank God need socialized medicine Health care America total mess Ridin Biden,"{'neg': 0.137, 'neu': 0.437, 'pos': 0.426, 'compound': 0.6486}",0.6486,0.437,0.426,0.137,Trump
3345,1.31717e+18,"RT @ChuckCallesto: BREAKING REPORT: RNC files FEDERAL ELECTION COMPLAINT against Twitter, alleging ""in-kind contributions to Biden...",https://twitter.com/honokeana/status/1317174388353978368,16/10/2020 18:43,1602870000000.0,350355017.0,Marcia🇺🇸#MAGA WWG1WGA🇺🇸🇺🇸⭐️⭐️⭐️,honokeana,"Huntington Beach, CA",,,,,1.31717e+18,,64,RT BREAKING REPORT RNC files FEDERAL ELECTION COMPLAINT Twitter alleging inkind contributions Biden,"{'neg': 0.196, 'neu': 0.804, 'pos': 0.0, 'compound': -0.4466}",-0.4466,0.804,0.0,0.196,Trump
3346,1.31717e+18,"RT @ChuckCallesto: BREAKING REPORT: RNC files FEDERAL ELECTION COMPLAINT against Twitter, alleging ""in-kind contributions to Biden...",https://twitter.com/USCANforDJT2020/status/1317174388249251842,16/10/2020 18:43,1602870000000.0,3809672776.0,Olivia Walker,USCANforDJT2020,,,,,,1.31717e+18,,64,RT BREAKING REPORT RNC files FEDERAL ELECTION COMPLAINT Twitter alleging inkind contributions Biden,"{'neg': 0.196, 'neu': 0.804, 'pos': 0.0, 'compound': -0.4466}",-0.4466,0.804,0.0,0.196,Trump
3348,1.31717e+18,"#EEUU Tratamiento dado a #Trump no es tan eficaz: OMS

https://t.co/29qmJGOAYT",https://twitter.com/DiarioCoahuila/status/1317174388446416902,16/10/2020 18:43,1602870000000.0,48206728.0,El Diario de Coahuila,DiarioCoahuila,"Saltillo, Coahuila, México",,,,,,,17,EEUU Tratamiento dado Trump es tan eficaz OM Shttpstco29qmJGOAYT,"{'neg': 0.0, 'neu': 1.0, 'pos': 0.0, 'compound': 0.0}",0.0,1.0,0.0,0.0,Trump
3352,1.31717e+18,RT @Usatorz1: Why was President Trump interrupted continuously by Savannah Guthrie?,https://twitter.com/Psykotiq325/status/1317174388748410883,16/10/2020 18:43,1602870000000.0,2303276380.0,RMH,Psykotiq325,Iceland,,,,,1.31717e+18,,-20,RT Why President Trump interrupted continuously Savannah Guthrie,"{'neg': 0.239, 'neu': 0.761, 'pos': 0.0, 'compound': -0.296}",-0.296,0.761,0.0,0.239,Trump
3354,1.31717e+18,RT @FuctupMike: Am I nuts or was Trump impeached for some shit Joe Biden did?,https://twitter.com/cloeykandb13/status/1317174392284094464,16/10/2020 18:43,1602870000000.0,1376527681.0,Christina Atkinson,cloeykandb13,Robeline La,,,,,1.31696e+18,,-86,RT Am I nuts Trump impeached shit Joe Biden,"{'neg': 0.496, 'neu': 0.504, 'pos': 0.0, 'compound': -0.7096}",-0.7096,0.504,0.0,0.496,Trump
3355,1.31717e+18,RT @SethDillon: .@Scaramucci should I respond to trump,https://twitter.com/bettybooptru2/status/1317174392288399360,16/10/2020 18:43,1602870000000.0,4890686305.0,Elena Rosario ⭐⭐⭐🇺🇸,bettybooptru2,,,,,,1.31711e+18,,-25,RT I respond trump,"{'neg': 0.0, 'neu': 1.0, 'pos': 0.0, 'compound': 0.0}",0.0,1.0,0.0,0.0,Trump
3356,1.31717e+18,RT @X22Report: Silent no more...,https://twitter.com/populistpepe2/status/1317174392128905217,16/10/2020 18:43,1602870000000.0,9.17113e+17,so very deplorable 🇺🇸🎃🤗🛸🐶,populistpepe2,"Arizona, USA",,,,,1.31716e+18,,-30,RT Silent,"{'neg': 0.0, 'neu': 1.0, 'pos': 0.0, 'compound': 0.0}",0.0,1.0,0.0,0.0,Trump
3357,1.31717e+18,@FoxNews Are Democrats yet demanded Trump to denounce Radical Islam?,https://twitter.com/cap_nio/status/1317174392384745473,16/10/2020 18:43,1602870000000.0,1.1583e+18,Captain America,cap_nio,Planet Earth,,,,,,1.31716e+18,20,Are Democrats yet demanded Trump denounce Radical Islam,"{'neg': 0.417, 'neu': 0.583, 'pos': 0.0, 'compound': -0.5106}",-0.5106,0.583,0.0,0.417,Trump
3359,1.31717e+18,RT @neontaster: When you hate Trump so much you forget how to read. https://t.co/Yo1GVPxM06,https://twitter.com/PenitusVox/status/1317174392359579648,16/10/2020 18:43,1602870000000.0,455444298.0,Prince of All Satans,PenitusVox,Purgatory,,,,,1.31717e+18,,11,RT When hate Trump much forget read httpstco Yo1GV PxM06,"{'neg': 0.412, 'neu': 0.588, 'pos': 0.0, 'compound': -0.6808}",-0.6808,0.588,0.0,0.412,Trump
3360,1.31717e+18,RT @DiamondandSilk: .@DiamondandSilk on the Women For Trump Bus.... #NorthCarolina https://t.co/2NRomcHHGx,https://twitter.com/pam5314Jones/status/1317174392355368960,16/10/2020 18:43,1602870000000.0,7.54054e+17,Pam Jones,pam5314Jones,,,,,,1.31717e+18,,44,RT Women For Trump Bus North Carolina httpstco2N RomcHH Gx,"{'neg': 0.0, 'neu': 1.0, 'pos': 0.0, 'compound': 0.0}",0.0,1.0,0.0,0.0,Trump
3362,1.31717e+18,No Way She Really Thought Criticizing Trump Would Ruin Her Career In Liberal Ass Hollywood,https://twitter.com/CFrom216/status/1317174392560955397,16/10/2020 18:43,1602870000000.0,1.2905e+18,Chris,CFrom216,,,,,,,,-3,No Way She Really Thought Criticizing Trump Would Ruin Her Career In Liberal Ass Hollywood,"{'neg': 0.527, 'neu': 0.473, 'pos': 0.0, 'compound': -0.9058}",-0.9058,0.473,0.0,0.527,Trump
3365,1.31717e+18,RT @SenDuckworth: Donald Trump's 112-day silence on #BountyGate says more than words ever could.,https://twitter.com/ShademLandry/status/1317174392799965189,16/10/2020 18:43,1602870000000.0,3054741346.0,Shadem,ShademLandry,"Massachusetts, USA",,,,,1.3171e+18,,2,RT Donald Trumps 112day silence Bounty Gate says words ever could,"{'neg': 0.0, 'neu': 1.0, 'pos': 0.0, 'compound': 0.0}",0.0,1.0,0.0,0.0,Trump
3366,1.31717e+18,"@Damaris522 @Elex_Michaelson Prepare to cry later, those are just early numbers with less than half the Trump numbers in.",https://twitter.com/JacksBa41760358/status/1317174392904806400,16/10/2020 18:43,1602870000000.0,1.3002e+18,Jack_Riemer,JacksBa41760358,LA,,,,,,1.31714e+18,-49,Prepare cry later early numbers less half Trump numbers,"{'neg': 0.279, 'neu': 0.721, 'pos': 0.0, 'compound': -0.4767}",-0.4767,0.721,0.0,0.279,Trump
3367,1.31717e+18,RT @SingerErnie: Senate report links Hunter Biden to 'prostitution or human trafficking ring' https://t.co/D4PIDh5qbj via @nypost,https://twitter.com/great_dare/status/1317174392812568577,16/10/2020 18:43,1602870000000.0,1.25298e+18,DareToBeGreat,great_dare,"Los Angeles, CA",,,,,1.31717e+18,,-25,RT Senate report links Hunter Biden prostitution human trafficking ring httpstcoD4PI Dh5qbj via,"{'neg': 0.0, 'neu': 1.0, 'pos': 0.0, 'compound': 0.0}",0.0,1.0,0.0,0.0,Trump
3368,1.31717e+18,"@seanhannity We are tired of Trump.  

Voting Biden.",https://twitter.com/DLeader45/status/1317174392913383425,16/10/2020 18:43,1602870000000.0,1.28183e+18,DearLeader45,DLeader45,,,,,,,1.31717e+18,-42,We tired Trump Voting Biden,"{'neg': 0.42, 'neu': 0.58, 'pos': 0.0, 'compound': -0.4404}",-0.4404,0.58,0.0,0.42,Trump
3373,1.31717e+18,@BernieSanders Biden has 32 Billionaires Backing him up . Joe Biden represents the elites. .https://t.co/bfDxkZMqK2,https://twitter.com/HanchoPOW/status/1317174396390395909,16/10/2020 18:43,1602870000000.0,1.22421e+18,S,HanchoPOW,CA,,,,,,1.31717e+18,-26,Biden 32 Billionaires Backing Joe Biden represents elites httpstcobf DxkZ MqK2,"{'neg': 0.0, 'neu': 0.901, 'pos': 0.099, 'compound': 0.0258}",0.0258,0.901,0.099,0.0,Trump
3374,1.31717e+18,Trump expresses all his pent-up contempt for women in two words to Guthrie: 'So cute' https://t.co/R3vIFxnKdi,https://twitter.com/klkolz/status/1317174396532948993,16/10/2020 18:43,1602870000000.0,322354051.0,Karen Kohls,klkolz,,,,,,,,-8,Trump expresses pentup contempt women two words Guthrie So cute httpstcoR3vI Fxn Kdi,"{'neg': 0.21, 'neu': 0.608, 'pos': 0.182, 'compound': -0.1298}",-0.1298,0.608,0.182,0.21,Trump
3376,1.31717e+18,"RT @DoNotATJack1: @williamlegate The deficit is like Trump's finances, both are bankrupt.

https://t.co/3g0x9UyXRh",https://twitter.com/JustitiaMatrona/status/1317174396952326144,16/10/2020 18:43,1602870000000.0,8.28816e+17,Republicans Want Fascism - VOTE BIDEN,JustitiaMatrona,Earth,,,,,1.31717e+18,,-15,RT The deficit like Trumps finances bankrupthttpstco3g0x9 UyX Rh,"{'neg': 0.221, 'neu': 0.574, 'pos': 0.205, 'compound': -0.0516}",-0.0516,0.574,0.205,0.221,Trump
3377,1.31717e+18,RT @JackPosobiec: Trump should have said Q Anon is just an idea,https://twitter.com/mrbarfiej/status/1317174396860223489,16/10/2020 18:43,1602870000000.0,970962211.0,JRsr,mrbarfiej,,,,,,1.3171e+18,,-43,RT Trump said Q Anon idea,"{'neg': 0.0, 'neu': 1.0, 'pos': 0.0, 'compound': 0.0}",0.0,1.0,0.0,0.0,Trump
3379,1.31717e+18,RT @hjelle_brian: No one departing the trump WH should be able to effortlessly merge back into polite society at the end.,https://twitter.com/Barryhallphd/status/1317174397170601985,16/10/2020 18:43,1602870000000.0,8.7974e+17,Barry,Barryhallphd,"St Petersburg, FL",,,,,1.31713e+18,,-2,RT No one departing trump WH able effortlessly merge back polite society end,"{'neg': 0.155, 'neu': 0.845, 'pos': 0.0, 'compound': -0.296}",-0.296,0.845,0.0,0.155,Trump
3383,1.31717e+18,RT @JackPosobiec: Trump should have said Q Anon is just an idea,https://twitter.com/LionessArising4/status/1317174397359325188,16/10/2020 18:43,1602870000000.0,1.0149e+18,LionessArising,LionessArising4,,,,,,1.3171e+18,,-43,RT Trump said Q Anon idea,"{'neg': 0.0, 'neu': 1.0, 'pos': 0.0, 'compound': 0.0}",0.0,1.0,0.0,0.0,Trump
3384,1.31717e+18,@RiaMidge @BetoORourke isn't that foreign interference in an election? Imagine if Russians call Americans to tell them to vote for Trump,https://twitter.com/Yvonne11972/status/1317174397317353472,16/10/2020 18:43,1602870000000.0,7.59075e+17,Yvonne I.,Yvonne11972,,,,,,,1.31624e+18,-34,isnt foreign interference election Imagine Russians call Americans tell vote Trump,"{'neg': 0.0, 'neu': 1.0, 'pos': 0.0, 'compound': 0.0}",0.0,1.0,0.0,0.0,Trump
3385,1.31717e+18,Savannah Guthrie Blasted For Hostile Behavior Toward Trump During Town Hall https://t.co/E1aDQU0UNq,https://twitter.com/TAnders54024797/status/1317174397317337088,16/10/2020 18:43,1602870000000.0,1.24357e+18,T Anderson,TAnders54024797,,,,,,,,-14,Savannah Guthrie Blasted For Hostile Behavior Toward Trump During Town Hall httpstcoE1aDQU0U Nq,"{'neg': 0.178, 'neu': 0.822, 'pos': 0.0, 'compound': -0.3818}",-0.3818,0.822,0.0,0.178,Trump
3386,1.31717e+18,"RT @ChuckCallesto: BREAKING REPORT: RNC files FEDERAL ELECTION COMPLAINT against Twitter, alleging ""in-kind contributions to Biden...",https://twitter.com/jrago1954/status/1317174397384511488,16/10/2020 18:43,1602870000000.0,1.24406e+18,Jrago1954,jrago1954,Usa ,,,,,1.31717e+18,,64,RT BREAKING REPORT RNC files FEDERAL ELECTION COMPLAINT Twitter alleging inkind contributions Biden,"{'neg': 0.196, 'neu': 0.804, 'pos': 0.0, 'compound': -0.4466}",-0.4466,0.804,0.0,0.196,Trump
3387,1.31717e+18,"RT @ChuckCallesto: BREAKING REPORT: RNC files FEDERAL ELECTION COMPLAINT against Twitter, alleging ""in-kind contributions to Biden...",https://twitter.com/rmoore0625/status/1317174397527097345,16/10/2020 18:43,1602870000000.0,7.09413e+17,Rhonda Rae,rmoore0625,,,,,,1.31717e+18,,64,RT BREAKING REPORT RNC files FEDERAL ELECTION COMPLAINT Twitter alleging inkind contributions Biden,"{'neg': 0.196, 'neu': 0.804, 'pos': 0.0, 'compound': -0.4466}",-0.4466,0.804,0.0,0.196,Trump
3388,1.31717e+18,RT @jdmaccoby: Trump showed he can lose a debate all by himself,https://twitter.com/WatchMeDesign/status/1317174397506064395,16/10/2020 18:43,1602870000000.0,418059138.0,Jennifer Wallace,WatchMeDesign,Dallas,,,,,1.31709e+18,,-50,RT Trump showed lose debate,"{'neg': 0.403, 'neu': 0.597, 'pos': 0.0, 'compound': -0.4019}",-0.4019,0.597,0.0,0.403,Trump
3391,1.31717e+18,"RT @Timcast: And Trump still beat Biden

Trump 4.5M Streamed network views
Biden 2.8M Streamed network views",https://twitter.com/andr3sc4st/status/1317174400794374144,16/10/2020 18:43,1602870000000.0,116856427.0,Andrés Castro,andr3sc4st,,,,,,1.31711e+18,,-67,RT And Trump still beat Biden Trump 45M Streamed network views Biden 28M Streamed network views,"{'neg': 0.0, 'neu': 1.0, 'pos': 0.0, 'compound': 0.0}",0.0,1.0,0.0,0.0,Trump
3398,1.31717e+18,RT @realDonaldTrump: Thank you!,https://twitter.com/memovene/status/1317174401226387456,16/10/2020 18:43,1602870000000.0,154978852.0,Guillermo,memovene,"Bogotá, D.C., Colombia",,,,,1.31704e+18,,-7,RT Thank,"{'neg': 0.0, 'neu': 0.286, 'pos': 0.714, 'compound': 0.3612}",0.3612,0.286,0.714,0.0,Trump
3400,1.31717e+18,RT @kylegriffin1: Why did Ben Sasse only attack Trump in private? Why does he say such different things in public about the president?,https://twitter.com/cmscalvert/status/1317174401285165057,16/10/2020 18:43,1602870000000.0,52108051.0,Chris M. Calvert,cmscalvert,"Philadelphia, PA",,,,,1.31696e+18,,-32,RT Why Ben Sasse attack Trump private Why say different things public president,"{'neg': 0.205, 'neu': 0.795, 'pos': 0.0, 'compound': -0.4767}",-0.4767,0.795,0.0,0.205,Trump
3401,1.31717e+18,RT @ddale8: Trump is trying out some #NewTone scripted material in a speech to Florida seniors. https://t.co/PJ4NKZiGAI,https://twitter.com/wondermomwic/status/1317174401226375170,16/10/2020 18:43,1602870000000.0,1321040010.0,wondermom,wondermomwic,,,,,,1.31717e+18,,11,RT Trump trying New Tone scripted material speech Florida seniors httpstcoPJ4NK ZiGAI,"{'neg': 0.0, 'neu': 1.0, 'pos': 0.0, 'compound': 0.0}",0.0,1.0,0.0,0.0,Trump
3402,1.31717e+18,"RT @funder: Network YouTube views as of 9pm

Biden: 507,445 ABC
Trump: 153,660 NBC",https://twitter.com/MAVYSHIL/status/1317174401339695112,16/10/2020 18:43,1602870000000.0,2252527134.0,M✖️,MAVYSHIL,"Manhattan, NY",,,,,1.31708e+18,,-28,RT Network You Tube views 9pm Biden 507445 ABC Trump 153660 NBC,"{'neg': 0.0, 'neu': 1.0, 'pos': 0.0, 'compound': 0.0}",0.0,1.0,0.0,0.0,Trump
3407,1.31717e+18,"@mkraju I don't think Biden has even called Trump's family a ""crime family"" even though they are.",https://twitter.com/gvravel/status/1317174401503211523,16/10/2020 18:43,1602870000000.0,309747604.0,𝓖𝓮𝓻𝓪𝓵𝓭𝓸 (𝓝𝓞𝓣 𝓡𝓲𝓿𝓮𝓻𝓪) 🇺🇲 💧,gvravel,Tejas,,,,,,1.31717e+18,46,I dont think Biden even called Trumps family crime family even though,"{'neg': 0.259, 'neu': 0.741, 'pos': 0.0, 'compound': -0.5423}",-0.5423,0.741,0.0,0.259,Trump
3410,1.31717e+18,RT @FuctupMike: Am I nuts or was Trump impeached for some shit Joe Biden did?,https://twitter.com/snickers9601/status/1317174404846157825,16/10/2020 18:43,1602870000000.0,39195848.0,mbellis,snickers9601,Toronto,,,,,1.31696e+18,,-86,RT Am I nuts Trump impeached shit Joe Biden,"{'neg': 0.496, 'neu': 0.504, 'pos': 0.0, 'compound': -0.7096}",-0.7096,0.504,0.0,0.496,Trump
3412,1.31717e+18,@GOP @realDonaldTrump https://t.co/N7a3oZgY6k,https://twitter.com/peacebike/status/1317174404531499009,16/10/2020 18:43,1602870000000.0,107507582.0,🏊🏻‍♂️🚴‍♂️🏃🏻‍♂️Charles Triathlon,peacebike,"Vermont, USA",,,"Sunrise, FL",United States,,1.31717e+18,-9,httpstcoN7a3o ZgY6k,"{'neg': 0.0, 'neu': 1.0, 'pos': 0.0, 'compound': 0.0}",0.0,1.0,0.0,0.0,Trump
3416,1.31717e+18,RT @LabyrinthWeaver: @realDonaldTrump @NBCNews @cspan https://t.co/Tx7LABU425,https://twitter.com/vondie1/status/1317174405240287232,16/10/2020 18:43,1602870000000.0,61126432.0,lisa vonderhaar,vondie1,,,,,,1.31684e+18,,-5,RT httpstco Tx7LABU425,"{'neg': 0.0, 'neu': 1.0, 'pos': 0.0, 'compound': 0.0}",0.0,1.0,0.0,0.0,Trump
3418,1.31717e+18,"RT @joncoopertweets: BREAKING: Donald Trump Has At Least $1 Billion In Debt, More Than Twice The Amount He Suggested https://t.co/SGRrEPO5tT",https://twitter.com/tishheaven/status/1317174405349265408,16/10/2020 18:43,1602870000000.0,24216012.0,Tish Heaven,tishheaven,,,,,,1.31713e+18,,2,RT BREAKING Donald Trump Has At Least 1 Billion In Debt More Than Twice The Amount He Suggested httpstcoSG RrEPO5tT,"{'neg': 0.122, 'neu': 0.878, 'pos': 0.0, 'compound': -0.3612}",-0.3612,0.878,0.0,0.122,Trump
3421,1.31717e+18,@realDonaldTrump @GStephanopoulos Great watch Joe for President go away Trump,https://twitter.com/v_mckenna001/status/1317174405286547456,16/10/2020 18:43,1602870000000.0,1267504820.0,redhead,v_mckenna001,"Dublin City, Ireland",,,,,,1.31705e+18,-40,Great watch Joe President go away Trump,"{'neg': 0.0, 'neu': 0.594, 'pos': 0.406, 'compound': 0.6249}",0.6249,0.594,0.406,0.0,Trump
3423,1.31717e+18,RT @DiamondandSilk: .@DiamondandSilk on the Women For Trump Bus.... #NorthCarolina https://t.co/2NRomcHHGx,https://twitter.com/Snoflaketrigger/status/1317174405517070336,16/10/2020 18:43,1602870000000.0,8.32023e+17,Snowflaketrigger,Snoflaketrigger,Shadow banned,,,,,1.31717e+18,,44,RT Women For Trump Bus North Carolina httpstco2N RomcHH Gx,"{'neg': 0.0, 'neu': 1.0, 'pos': 0.0, 'compound': 0.0}",0.0,1.0,0.0,0.0,Trump
3424,1.31717e+18,"RT @toddstarnes: Trump should've asked @SavannahGuthrie if she denounces Matt Lauer. Savannah, do you support sexual predators?",https://twitter.com/PattonHawkMaga/status/1317174405542211584,16/10/2020 18:43,1602870000000.0,8.8559e+17,pattonmaga,PattonHawkMaga,93265,,,,,1.31715e+18,,-26,RT Trump shouldve asked denounces Matt Lauer Savannah support sexual predators,"{'neg': 0.199, 'neu': 0.616, 'pos': 0.185, 'compound': -0.0516}",-0.0516,0.616,0.185,0.199,Trump
3425,1.31717e+18,RT @FuctupMike: Am I nuts or was Trump impeached for some shit Joe Biden did?,https://twitter.com/TV05646769/status/1317174408910458882,16/10/2020 18:43,1602870000000.0,1.0476e+18,midnight star ⭐️🇺🇸,TV05646769,,,,,,1.31696e+18,,-86,RT Am I nuts Trump impeached shit Joe Biden,"{'neg': 0.496, 'neu': 0.504, 'pos': 0.0, 'compound': -0.7096}",-0.7096,0.504,0.0,0.496,Trump
3427,1.31717e+18,@EricTrump I disagree... voting for Biden.,https://twitter.com/CalRedwoodtree/status/1317174409241653248,16/10/2020 18:43,1602870000000.0,2369708467.0,Prouddaughter of WW2 Veteran,CalRedwoodtree,California,,,,,,1.31707e+18,-20,I disagree voting Biden,"{'neg': 0.565, 'neu': 0.435, 'pos': 0.0, 'compound': -0.3818}",-0.3818,0.435,0.0,0.565,Trump
3432,1.31717e+18,"RT @realDonaldTrump: Thank you LIBERTARIANS. We are getting it all done, and FAST! VOTE TRUMP!!!",https://twitter.com/CHRIS19D81/status/1317174409656815618,16/10/2020 18:43,1602870000000.0,1.28332e+18,Chris_19D🇺🇲💯,CHRIS19D81,,,,,,1.31706e+18,,-17,RT Thank LIBERTARIANS We getting done FAST VOTE TRUMP,"{'neg': 0.0, 'neu': 0.618, 'pos': 0.382, 'compound': 0.516}",0.516,0.618,0.382,0.0,Trump
3433,1.31717e+18,RT @brettturner57: Trump went by my office today. My salute to the commander in cheat! https://t.co/5xXEK51oWJ,https://twitter.com/gbvoces1/status/1317174409812045825,16/10/2020 18:43,1602870000000.0,2988286017.0,kidMarine,gbvoces1,"Oregon, USA",,,,,1.31716e+18,,58,RT Trump went office today My salute commander cheat httpstco5xXEK51oWJ,"{'neg': 0.25, 'neu': 0.75, 'pos': 0.0, 'compound': -0.4588}",-0.4588,0.75,0.0,0.25,Trump
3435,1.31717e+18,@realDonaldTrump Does anyone refer to Trump as Big T? Fragile E has a nice ring to it...  @FoxNews @jimmykimmel,https://twitter.com/kwollins/status/1317174409854177280,16/10/2020 18:43,1602870000000.0,14350572.0,kwollins,kwollins,,,,,,,1.31708e+18,-58,Does anyone refer Trump Big T Fragile E nice ring,"{'neg': 0.0, 'neu': 0.714, 'pos': 0.286, 'compound': 0.4215}",0.4215,0.714,0.286,0.0,Trump
3438,1.31717e+18,"POLL
Job Approval Rating

Do you approve of the job that President Trump is doing?",https://twitter.com/teamronnie2012/status/1317174410160132100,16/10/2020 18:43,1602870000000.0,805236253.0,Ron Starr,teamronnie2012,San Jose Ca.,,,,,,,4,POLL Job Approval Rating Do approve job President Trump,"{'neg': 0.0, 'neu': 0.721, 'pos': 0.279, 'compound': 0.4767}",0.4767,0.721,0.279,0.0,Trump
3442,1.31717e+18,"RT @BishesBrew: @ddale8 In summation, Trump cannot be trusted for any reason.",https://twitter.com/EllenSDuffy1/status/1317174412924325889,16/10/2020 18:43,1602870000000.0,9.68988e+17,Ellen S Duffy,EllenSDuffy1,"Chicago, IL",,,,,1.31712e+18,,-14,RT In summation Trump trusted reason,"{'neg': 0.0, 'neu': 0.617, 'pos': 0.383, 'compound': 0.4767}",0.4767,0.617,0.383,0.0,Trump
3443,1.31717e+18,RT @grosemarie_: rt if ur from CA and would rather live in hell than have another 4yrs of trump,https://twitter.com/unicornlala_/status/1317174413284888576,16/10/2020 18:43,1602870000000.0,311119905.0,lezzlie,unicornlala_,,,,,,1.31574e+18,,-65,RT rt ur CA would rather live hell another 4yrs trump,"{'neg': 0.315, 'neu': 0.685, 'pos': 0.0, 'compound': -0.6808}",-0.6808,0.685,0.0,0.315,Trump
3446,1.31717e+18,"RT @TrumpWarRoom: Smoking-gun email reveals how Hunter Biden introduced Ukrainian businessman to VP dad
https://t.co/HMou7ncDzP",https://twitter.com/perdupa521/status/1317174413754691584,16/10/2020 18:43,1602870000000.0,1.28025e+18,SuZZeeeQ✨,perdupa521,"Las Vegas, NV",,,,,1.31716e+18,,-17,RT Smokinggun email reveals Hunter Biden introduced Ukrainian businessman VP dadhttpstcoH Mou7nc DzP,"{'neg': 0.0, 'neu': 1.0, 'pos': 0.0, 'compound': 0.0}",0.0,1.0,0.0,0.0,Trump
3447,1.31717e+18,RT @thebr0keb0i: Is Donald Trump compromised by foreign adversaries?,https://twitter.com/dbluewave20/status/1317174413712781312,16/10/2020 18:43,1602870000000.0,1.24322e+18,DDbluewave20,dbluewave20,,,,,,1.31717e+18,,-9,RT Is Donald Trump compromised foreign adversaries,"{'neg': 0.25, 'neu': 0.75, 'pos': 0.0, 'compound': -0.25}",-0.25,0.75,0.0,0.25,Trump
